id,quran_ayas_id,quran_ayas_languages_code,number,text
ENAA4125,QA4125,ENAA,4125,"They do not esteem God as is rightly due to Him. The whole earth would be a fistful of His on the Day of Resurrection, and the heavens would be rolled up in His right hand. Too immaculate is He and too high for what they associate with Him!"
ENAA4126,QA4126,ENAA,4126,"When the trumpet blast is sounded whoever is in the heavens and the earth will swoon away, except those God please. When the blast is sounded the second time, they will stand up all expectant."
ENAA4127,QA4127,ENAA,4127,"The earth will light up with the effulgence of her Lord; and the ledger (of account) will be placed (in each man's hand), and the apostles and the witnesses will be called, and judgement passed between them equitably, and no wrong will be done to them."
ENAA4128,QA4128,ENAA,4128,Each soul will be paid in full for what it had done. He is cognisant of what you do.
ENAA4129,QA4129,ENAA,4129,"The unbelievers will be driven into Hell in groups till, when they reach it and its doors are opened up, its keepers will say to them: ""Did not apostles of your own come to you reciting your Lord's revelations, warning you of this your day of Doom?"" They will answer: ""Yes;"" but the sentence of punishment was justified against the unbelievers."
ENAA4130,QA4130,ENAA,4130,"""Enter the gates of Hell,"" they will be told, ""and there abide for ever."" How grievous a destination for the haughty!"
ENAA4131,QA4131,ENAA,4131,"Those who were mindful of their duty to their Lord will be driven in groups to Paradise, till they reach it and its gates are opened, and its keepers say to them: ""Peace be on you; you are the joyous. So enter here to live for ever."""
ENAA4132,QA4132,ENAA,4132,"They will say: ""All praise be to God Who has fulfilled the promise He had made to us, and bequeathed to us this land for dwelling in the garden wheresoever we like."" How excellent the recompense for those who act!"
ENAA4133,QA4133,ENAA,4133,"You will see the angels hover round the Throne, singing the praises of their Lord; and justice will be done between them equitably, and it would be said: ""All praise to God the Lord of all the worlds."""
ENAA4134,QA4134,ENAA,4134,HA MIM.
ENAA4135,QA4135,ENAA,4135,"The revelation of this Book is from God the all-mighty and all-knowing,"
ENAA4136,QA4136,ENAA,4136,"Forgiver of trespasses, acceptor of repentance, severe of retribution, lord of power. There is no god but He. Towards Him is your destination."
ENAA4137,QA4137,ENAA,4137,Only the unbelievers dispute the revelations of God. So do not let their activities in the land deceive you.
ENAA4138,QA4138,ENAA,4138,"The people of Noah had denied before them, and many factions after them. Every nation has intrigued against its apostle and afflicted him, and argued with false arguments to condemn the truth. Then I seized them. How was then My retribution!"
ENAA4139,QA4139,ENAA,4139,"In this way the sentence of your Lord against the infidels that they would be the inmates of Hell, was justified."
ENAA4140,QA4140,ENAA,4140,"The bearers of the Throne, and those around it, sing the praises of their Lord and believe in Him, and seek forgiveness for those who believe: ""O our Lord, Your mercy and knowledge embrace everything; so forgive those who turn to You in repentance and follow Your path; and preserve them from the torment of Hell."
ENAA4141,QA4141,ENAA,4141,"Admit them, O Lord, to the garden of Eden which You promised them, and those of their fathers, spouses and progeny who are upright. You are truly all-mighty and all-wise."
ENAA4142,QA4142,ENAA,4142,"Protect them from evil; and whosoever You preserve from evil on that Day shall have surely received Your mercy. This will be the great triumph."""
ENAA4143,QA4143,ENAA,4143,"Those who disbelieve will certainly be told: ""God's displeasure was greater than your disgust of your selves when you were called to belief and refused to believe."""
ENAA4144,QA4144,ENAA,4144,"They say: ""O Lord, twice You made us die, and twice You made us live. We admit our sins. Is there still a way out for us?"""
ENAA4145,QA4145,ENAA,4145,"This has come upon you because when God alone was invoked you disbelieved; but when partners were associated with Him, you believed. But judgement belongs to God, the all-high and supreme."
ENAA4146,QA4146,ENAA,4146,"It is He who shows you His signs, and sends you food from the heavens. Yet none takes a warning except him who turns to Him."
ENAA4147,QA4147,ENAA,4147,"So call on God with exclusive obedience, howsoever the unbelievers may dislike it."
ENAA4148,QA4148,ENAA,4148,"Most exalted of position, Lord of power, He directs inspiration by His command to any of His creatures as He will, to warn (men) of the Day of Meeting,"
ENAA4149,QA4149,ENAA,4149,"The day when they will come out (of their graves), with nothing of them hidden from God. Whose then will be the kingdom? -- God's, the one, the omnipotent."
ENAA4150,QA4150,ENAA,4150,Each soul will be recompensed that Day for what it had earned. There will be no depriving on that Day. Surely God is swift at reckoning.
ENAA4151,QA4151,ENAA,4151,"Warn them of the coming day inevitable, when hearts would jump to the throats, filling them with anguish. The sinners will have neither friend nor intercessor whose (word) will be heeded."
ENAA4152,QA4152,ENAA,4152,"Known to Him is the treachery of the eye, and what the breasts conceal."
ENAA4153,QA4153,ENAA,4153,"God decides with justice. But those they call apart from Him can not adjudge in the least. Verily God is all-hearing, all-perceiving."
ENAA4154,QA4154,ENAA,4154,"Have they not travelled on the earth that they could see what happened to those before them? They were greater in strength than they, and have left behind them traces on the earth. Yet they were seized by God for their sins, and had none to protect them against God."
ENAA4155,QA4155,ENAA,4155,"This was so because their apostles came with clear proofs to them, but they refused to believe. So they were seized by God. Surely God is powerful, unrelenting in retribution."
ENAA4156,QA4156,ENAA,4156,We sent Moses with Our signs and clear authority
ENAA4157,QA4157,ENAA,4157,"To Pharaoh, Haman and Qarun. But they said: ""He is only a deceiving sorcerer."""
ENAA4158,QA4158,ENAA,4158,"And when he brought the truth to them from Us, they said: ""Slay the sons of those who believe with him, and spare their women."" But the unbelievers' stratagem is bound to fail."
ENAA4159,QA4159,ENAA,4159,"""Let me kill Moses,"" the Pharaoh said, ""and let him call to his Lord. I fear that he will change your faith and spread corruption in the land."""
ENAA4160,QA4160,ENAA,4160,"Moses said: ""I seek refuge in my Lord and your Lord from every insolent imposter who does not believe in the Day of Reckoning."""
ENAA4161,QA4161,ENAA,4161,"A believer from the House of Pharaoh who had kept his faith to himself, said: ""Will you kill a man because he says: 'My Lord is God,' when he has brought clear signs from his Lord to you? If he is a liar his lie will recoil back on him; but in case he speaks the truth, then what he predicts will befall you. Surely God does not show the way to the shameful liar."
ENAA4162,QA4162,ENAA,4162,"O my people, authority is yours today being the most powerful in the land; but who will save us from the scourge of God if it fall upon us?"" ""I show you,"" said the Pharaoh, ""only what I see (is right), and guide you but to the right path."""
ENAA4163,QA4163,ENAA,4163,"But the man of belief said: ""O my people, what I fear for you is the like of what befell the communities (of old)."
ENAA4164,QA4164,ENAA,4164,"Like the people of Noah, 'Ad and Thamud, and those that came after them. God does not want to be unjust to His creatures."
ENAA4165,QA4165,ENAA,4165,"O my people, what I fear for you is the day of gathering, crying and calling,"
ENAA4166,QA4166,ENAA,4166,"The day you will turn your backs and flee, with none to defend you against God. Whoever God allows to go astray has none to show him the way."
ENAA4167,QA4167,ENAA,4167,"Joseph had indeed come to you before with clear proofs, but you did not cease to doubt what he had brought until he died, when you said: 'God will not send a prophet after him.' That is how God leads the waster, the sceptic astray."
ENAA4168,QA4168,ENAA,4168,"Those who dispute God's revelations, with no authority having come to them, (are) greatly odious in the sight of God, and the sight of those who believe. That is how God seals every proud and perverse heart."""
ENAA4169,QA4169,ENAA,4169,"The Pharaoh said: ""O Haman, build me a lofty tower that I may perhaps find the means"
ENAA4170,QA4170,ENAA,4170,"Of reaching the tracts of heaven and look at the god of Moses, though I think that he is a liar."" Thus were the evil deeds of Pharaoh made to look attractive to him, and he was hindered from the path. So the stratagem of Pharaoh was bound to perish."
ENAA4171,QA4171,ENAA,4171,"The man who believed said: ""O my people, follow me; I will guide you to the right path."
ENAA4172,QA4172,ENAA,4172,"O people, the life of this world is ephemeral; but enduring is the abode of the Hereafter."
ENAA4173,QA4173,ENAA,4173,"Whoever does evil will be requited in accordance with it; but whoever does right, whether man or woman, and is a believer, will enter Paradise, where they will have provision in abundance."
ENAA4174,QA4174,ENAA,4174,"O my people, what is wrong with me that I am calling you to preservation, while you invite me to the Fire!"
ENAA4175,QA4175,ENAA,4175,"You are asking me to disbelieve in God, and to associate with Him that of which I have no knowledge, yet I invite you to the all-mighty, all-forgiving."
ENAA4176,QA4176,ENAA,4176,"What you are calling me to is surely not worth the calling in this world or in the next, because our returning is to God; and because the transgressors will be inmates of Hell."
ENAA4177,QA4177,ENAA,4177,"You will remember what I say in time to come; I submit my case to the judgement of God. Surely God keeps an eye on His creatures."""
ENAA4178,QA4178,ENAA,4178,So God preserved him from the evil they were planning; and a dreadful doom encompassed the people of Pharaoh:
ENAA4179,QA4179,ENAA,4179,"Fire, to which they are exposed morning and evening. The day the Hour is proclaimed (it will be said:) ""Admit the people of Pharaoh to the severest punishment,"""
ENAA4180,QA4180,ENAA,4180,"As they will noisily argue in the Fire, the weaker ones will say to the arrogant: ""We were your followers, so will you take over some of our share of the fire?"""
ENAA4181,QA4181,ENAA,4181,"The arrogant will answer: ""All of us are in it. Surely God has judged between His creatures."""
ENAA4182,QA4182,ENAA,4182,"Those in the Fire will say to the warders of Hell: ""Ask your Lord to reduce the punishment by a day for us."""
ENAA4183,QA4183,ENAA,4183,"They will say: ""Did not your apostles come to you with clear proofs?"" They will answer: ""Indeed, they did."" ""Then pray,"" will (the warders) say. But the praying of unbelievers will be all in vain."
ENAA4184,QA4184,ENAA,4184,"We will certainly help Our messengers and those who believe, in this world, and on the day the witnesses take their stand,"
ENAA4185,QA4185,ENAA,4185,"The day upon which their excuses will not benefit the evil-doers, and the condemnation and evil abode will be theirs."
ENAA4186,QA4186,ENAA,4186,"Verily We showed Moses the way, and bequeathed the Book to the children of Israel,"
ENAA4187,QA4187,ENAA,4187,A guidance and reminder for men of wisdom.
ENAA4188,QA4188,ENAA,4188,"So persevere; the promise of God is true; and seek forgiveness for your sins, and chant the praises of your Lord evening and morning."
ENAA4189,QA4189,ENAA,4189,"Verily those who argue in the matter of God's revelations, without authority having reached them, have nothing but pride in their hearts, and they will not achieve their end. So take refuge in God: Surely He is all-hearing and all-seeing."
ENAA4190,QA4190,ENAA,4190,The creation of the heavens and the earth is indeed of greater magnitude than the creation of mankind; but most men do not understand.
ENAA4191,QA4191,ENAA,4191,"The blind and the seeing are surely not alike, nor those who believe and act rightly and those who do evil. Little do you reflect!"
ENAA4192,QA4192,ENAA,4192,The Hour will certainly come; there is no mystery about it; but most men do not believe.
ENAA4193,QA4193,ENAA,4193,"Your Lord has said: ""Call to Me that I may answer your call. Surely those who disdain worshipping Me will enter Hell, disgraced."""
ENAA4194,QA4194,ENAA,4194,"It is God who made the night for you to rest, the day to make things visible. Indeed God is gracious to men, but most men are not grateful."
ENAA4195,QA4195,ENAA,4195,"He is God your Lord, creator of everything. There is no god but He. How then do you turn away (from Him)?"
ENAA4196,QA4196,ENAA,4196,Only they are turned away thus who deny the signs of God.
ENAA4197,QA4197,ENAA,4197,"It is God who made the earth a dwelling for you, and the sky a vaulted roof, who fashioned you and gave you excellent form and provided you with clean and wholesome things. He is God, your Lord. So blessed be God, the Lord of all the worlds."
ENAA4198,QA4198,ENAA,4198,"He is the living. There is no god but He. Therefore pray to Him with obedience all-exclusive. Praise be to God, the Lord of all the worlds."
ENAA4199,QA4199,ENAA,4199,"Say: ""I am forbidden to worship those you call apart from God, since clear signs have come to me from my Lord, and I am commanded to submit to the Lord of all the worlds."""
ENAA4200,QA4200,ENAA,4200,"It is He who created you from dust, then a drop of semen, then the embryo; afterwards He brings you forth as a child; then you attain the age of manhood, and then reach old age. But some of you die before you reach the appointed term that you may haply understand."
ENAA4201,QA4201,ENAA,4201,"It is He who gives you life and death. When He creates a thing, He has only to say: ""Be,"" and it is."
ENAA4202,QA4202,ENAA,4202,Have you not seen how those who dispute the signs of God are turned away?
ENAA4203,QA4203,ENAA,4203,"Those who deny the Book and what We have sent down with Our apostles, will soon come to know"
ENAA4204,QA4204,ENAA,4204,"When, with (iron) collars and chains around their necks, they will be dragged"
ENAA4205,QA4205,ENAA,4205,"Through boiling water, and then burnt in the Fire."
ENAA4206,QA4206,ENAA,4206,"They will then be asked: ""Where are they you took as partners"
ENAA4207,QA4207,ENAA,4207,"Apart from God?"" They will answer: ""They have left us in the lurch and fled. In fact it was nothing that we prayed to before."" That is how God sends the unbelievers astray."
ENAA4208,QA4208,ENAA,4208,"""This is so because you went about exulting wrongfully in the land,"" (will they be told), ""and you were insolent."
ENAA4209,QA4209,ENAA,4209,"So enter the gates of Hell to abide in it for ever."" How evil the abode of the arrogant!"
ENAA4210,QA4210,ENAA,4210,"So you persevere with patience (in your mission). The promise of God is true. Whether We show you some of the punishment We have promised them, or gather you up in death, they have to come back to Us."
ENAA4211,QA4211,ENAA,4211,"Surely We have sent apostles before you, some of whose account We have related to you, and that of some We have not told you. But no apostle was given a miracle unless God dispensed. But when the decree of God comes the sentence is passed with justice; and the lovers of vice and vanity will then come to grief."
ENAA4212,QA4212,ENAA,4212,It is God who made the cattle for you so that some you ride and some you eat.
ENAA4213,QA4213,ENAA,4213,"There are advantages for you in them, so that you may satisfy your needs through them, and may be borne upon them and on ships."
ENAA4214,QA4214,ENAA,4214,He shows His signs. How many of God's signs will you then deny?
ENAA4215,QA4215,ENAA,4215,"Have they not travelled in the land and seen how was the end of those before them who were far more numerous than they and more strong, and have left behind them traces on the earth. And yet nothing of what they did profited them."
ENAA4216,QA4216,ENAA,4216,"For when Our apostles came to them with clear proofs, they boasted and exulted at the knowledge they possessed; but what they used to mock recoiled back on them,"
ENAA4217,QA4217,ENAA,4217,"So that when they saw Our might, they said: ""We believe in God the one and single, and reject those we associated (with Him)."" --"
ENAA4218,QA4218,ENAA,4218,"But then their affirming served them nothing after they had seen Our torment. This is the law of God that has prevailed among His creatures, Then the unbelievers went to rack and ruin."
ENAA4219,QA4219,ENAA,4219,HA MIM.
ENAA4220,QA4220,ENAA,4220,"A revelation from the most benevolent, ever-merciful,"
ENAA4221,QA4221,ENAA,4221,"A Book whose verses have been distinguished and explained, a lucid discourse for people who understand,"
ENAA4222,QA4222,ENAA,4222,"Announcing happy news and warnings. And yet most of them are averse and do not listen,"
ENAA4223,QA4223,ENAA,4223,"And say: ""Our hearts are immured against what you call us to. There is a deafness in our ears, and a veil lies between us and you. So act (your way), we are acting (ours)."""
ENAA4224,QA4224,ENAA,4224,"Say: ""I am a man like you, (but) it is revealed to me that your God is one God, so take the straight path to Him, and ask Him to forgive your sins. Woe to the idolaters"
ENAA4225,QA4225,ENAA,4225,"Who do not give a due share of their wealth for the welfare of others, and do not believe in the Hereafter."
ENAA4226,QA4226,ENAA,4226,"But those who believe and do the right, will have a continuing reward."
ENAA4227,QA4227,ENAA,4227,"Say: ""Do you refuse to believe in Him who created the earth in two spans of time, and set up compeers to Him, the Lord of all the worlds?"
ENAA4228,QA4228,ENAA,4228,"He placed firm stabilisers rising above its surface, blessed it with plenty and growth, and ingrained the means of growing its food within it, sufficient for all seekers, in four spans."
ENAA4229,QA4229,ENAA,4229,"Then He turned to the heavens, and it was smoke. So He said to it and the earth: ""Come with willing obedience or perforce."" They said: ""We come willingly."""
ENAA4230,QA4230,ENAA,4230,"Then He created several skies in two spans, and ingrained in each sky its function, decking the nearest heaven with lamps, and guarded it. This has been determined by the mighty and all-knowing."
ENAA4231,QA4231,ENAA,4231,"If even then they turn away, tell them: ""I forewarn you of a terrible punishment like the thunderbolt that fell upon the 'Ad and Thamud."""
ENAA4232,QA4232,ENAA,4232,"Their apostles came to them one after the other (saying): ""Do not worship any one but God."" They said: ""If our Lord had pleased He would have sent the angels down. We reject what is sent with you."""
ENAA4233,QA4233,ENAA,4233,"So those who were 'Ad turned insolent unjustly in the land, and said: ""Who is stronger than us?"" Did they not see that God who created them was greater far in power than they? Yet they refused to believe Our signs."
ENAA4234,QA4234,ENAA,4234,"So We let loose on them a violent wind for several days of distress to make them taste a most disgraceful punishment here in this world, and far more shameful will be the punishment in the Hereafter, and there will be no succour for them."
ENAA4235,QA4235,ENAA,4235,"As for the (tribe of) Thamud, We tried to guide them, but they preferred blindness to guidance; then they were seized by the torment of a humiliating punishment as requital for their misdeeds;"
ENAA4236,QA4236,ENAA,4236,But We saved those who believed and took heed for themselves.
ENAA4237,QA4237,ENAA,4237,"The day the enemies of God will be gathered at the Fire and the records of their deeds will be distributed,"
ENAA4238,QA4238,ENAA,4238,So that when they reach it their ears and eyes and persons will testify to what they did.
ENAA4239,QA4239,ENAA,4239,"And they will say to their bodies: ""Why did you testify against us?"" They will answer: ""God, who gave all things power of articulation, made us speak. It is He who created you the first time, and to Him you will return."
ENAA4240,QA4240,ENAA,4240,You did not hide your (doings) so that your ears or eyes or persons should not testify against you. In fact you thought that God did not know the things you used to do.
ENAA4241,QA4241,ENAA,4241,"It is this notion you had of your Lord that caused your ruin, and you are lost."""
ENAA4242,QA4242,ENAA,4242,"Even if they are patient, their abode is Hell; and if they beg for favour, none will favour them."
ENAA4243,QA4243,ENAA,4243,We had assigned to them close companions who made their past and present look attractive to them; and the fate that had once befallen the communities of jinns and men before them was justified upon them. They were indeed bound to perish.
ENAA4244,QA4244,ENAA,4244,"The disbelievers say: ""Do not listen to this Qur'an, and shout away (its reading); you may haply prevail."""
ENAA4245,QA4245,ENAA,4245,"We shall make the disbelievers taste the severest punishment, and retribute them for the worst that they had done."
ENAA4246,QA4246,ENAA,4246,"This is the requital for God's enemies: Hell, where they will have their lasting home, as punishment for denying Our revelations."
ENAA4247,QA4247,ENAA,4247,"Those who disbelieve will say: ""O Lord, show us those among the jinns and men who had led us astray that we may trample them underfoot and make them wholly abject."""
ENAA4248,QA4248,ENAA,4248,"Surely the angels will come down to those who say, 'Our Lord is God' and then remain steadfast, saying: ""You should have neither fear nor regret, but rejoice in the happy news of Paradise that has been promised you."
ENAA4249,QA4249,ENAA,4249,"We are your friends in this life and in the Hereafter where you will get whatever your hearts desire, and have whatsoever you ask for,"
ENAA4250,QA4250,ENAA,4250,"As a gift from the forgiving, ever-merciful (God)."""
ENAA4251,QA4251,ENAA,4251,"Whose word is better than his who calls to God and does the right, and says: ""I am of the obedient?"""
ENAA4252,QA4252,ENAA,4252,Good and evil are not alike. Repel evil with what is good. Then you will find your erstwhile enemy like a close. affectionate friend.
ENAA4253,QA4253,ENAA,4253,"Only they attain it who forbear, and only a man of great good fortune can achieve it."
ENAA4254,QA4254,ENAA,4254,"If the Devil incite you to evil, seek refuge in God. He is all-hearing and all-knowing."
ENAA4255,QA4255,ENAA,4255,"The night and day and the sun and moon are (only) some of His signs. So do not bow before the sun and the moon, but bow in homage to God who created them, if you truly worship Him."
ENAA4256,QA4256,ENAA,4256,But if they become haughty (then remember) that those who are close to your Lord sing His praises night and day and do not grow weary of (doing so).
ENAA4257,QA4257,ENAA,4257,It is among His signs that the earth you see all barren and desolate begins to stir and sprout when We send down rain upon it. Surely He who gives it life will also give life to the dead. Indeed He has power over everything.
ENAA4258,QA4258,ENAA,4258,"Surely those who slander Our signs are not hidden from Us. Then, is he better who will be cast into Hell, or he who will come out safe on the Day of Resurrection? Do whatever you will, He sees whatsoever you do."
ENAA4259,QA4259,ENAA,4259,Those who reject the Reminder when it has come to them (should know) that it is a Book inviolate.
ENAA4260,QA4260,ENAA,4260,Falsehood cannot enter it from any side: It's a revelation from the all-wise and praiseworthy (God).
ENAA4261,QA4261,ENAA,4261,"Nothing is said to you which had not been said to other apostles before you. Surely your Lord is the lord of forgiveness, but also the lord of severe retribution."
ENAA4262,QA4262,ENAA,4262,"If We had made it a discourse in an obscure tongue, they would have said: ""Why were its revelations not expounded distinctly? A foreign tongue and an Arab (audience)?"" Say: ""For those who believe it is a guidance and a healing; but for those who do not believe it is a deafness in the ears, and a blindness. They are those one calls to from far away."
ENAA4263,QA4263,ENAA,4263,Verily We gave Moses the Book; but they began to differ about it. If the Word of your Lord had not preceded it the matter would have been settled between them. They are still in doubt about it and uneasy.
ENAA4264,QA4264,ENAA,4264,"Whoever does good does so for himself, and whoever does wrong bears the guilt thereof. Your Lord does no wrong to His creatures."
ENAA4265,QA4265,ENAA,4265,"He alone has knowledge of the Hour (of change): No fruit comes Out of its spathe, no female conceives or gives birth, but He has knowledge of it. The day He will call them (and ask): ""Where are the compeers (you ascribed to Me)?"" They will answer: ""We profess to You not one of us can vouch for them."""
ENAA4266,QA4266,ENAA,4266,"And those they used to worship will leave them in the lurch, and they will realise there is no escape for them."
ENAA4267,QA4267,ENAA,4267,Man never tires of praying for good; but if evil assails him he begins to despair.
ENAA4268,QA4268,ENAA,4268,"If We give him a taste of Our favour after some distress he has known, he says: ""It was my due. I cannot imagine the Hour will come. And even if I go back to my Lord, there will surely still be the best for me with Him."" We shall tell those who do not believe what they used to do, and inflict on them a heavy punishment."
ENAA4269,QA4269,ENAA,4269,When We show Our favours to man he moves away and turns aside; but when in trouble he prays a great deal.
