id,quran_ayas_id,quran_ayas_languages_code,number,text
ENAA1033,QA1033,ENAA,1033,"Saleh turned away from them and said: ""O my people, I conveyed to you the message of my Lord and warned you; but you do not like those who wish you well."""
ENAA1034,QA1034,ENAA,1034,"And We sent Lot, who said to his people: ""Why do you commit this lecherous act which none in the world has committed before?"
ENAA1035,QA1035,ENAA,1035,"In preference to women you satisfy your lust with men. Indeed you are a people who are guilty of excess."""
ENAA1036,QA1036,ENAA,1036,"His people made no answer, and only said: ""Drive them out of the city. They profess to be pure."""
ENAA1037,QA1037,ENAA,1037,"But We saved him and his family, except for his wife who was one of those who stayed behind."
ENAA1038,QA1038,ENAA,1038,And We rained down on them a shower (of Stones). So witness the end of sinners!
ENAA1039,QA1039,ENAA,1039,"Remember, We sent to Midian their brother Shu'aib. ""O you people,"" he said, ""worship God, for you have no other god but He. Clear proof has come to you from your Lord; so give in full measure and full weight; do not keep back from people what is theirs, and do not corrupt the land after it has been reformed. This is best for you if you believe."
ENAA1040,QA1040,ENAA,1040,"Do not lie in ambush to intimidate and divert from the path of God those who believe in Him, nor seek obliquity in it. Remember the day when you were few and He increased your numbers. So consider the fate of those who were evil."
ENAA1041,QA1041,ENAA,1041,"If some of you believe what has been sent through me, and some of you do not, have patience until God decide between us, for He is the best of all judges."""
ENAA1042,QA1042,ENAA,1042,"The arrogant leaders of the people replied: ""We shall drive you away from our land, O Shu'aib, and those who are with you, unless you come back to your faith."" But he remarked: ""Even if we are disgusted with it?"
ENAA1043,QA1043,ENAA,1043,"We shall only be guilty of blaspheming God if we accept your way after the people of Noah, and gave you a greater increase in your stature. So think of the favours of God; you may haply be blessed."""
ENAA1044,QA1044,ENAA,1044,"The chiefs among his people who did not believe said (to them): ""If you follow Shu'aib and his way you will surely be ruined."""
ENAA1045,QA1045,ENAA,1045,"Then they were seized by an earthquake, and lay overturned on the ground in their homes in the morning."
ENAA1046,QA1046,ENAA,1046,They who called Shu'aib a liar (disappeared) as though they had never existed; and those who called Shu'aib a liar were the ones who were ruined!
ENAA1047,QA1047,ENAA,1047,"So Shu'aib turned away from them and said: ""O people, I conveyed to you the message of my Lord, and warned you. (But you paid no heed). How can I grieve for a people who do not believe?"""
ENAA1048,QA1048,ENAA,1048,There is not a region to which We sent a prophet and did not inflict upon its people adversity and hardship so that they may submit.
ENAA1049,QA1049,ENAA,1049,"But when We changed hardship to ease, and they rose and prospered, (they forgot Our favours) and said: ""Our ancestors had also known suffering and joy."" So We caught them unawares."
ENAA1050,QA1050,ENAA,1050,"But if the people of these regions had believed and feared God, We would surely have showered on them blessings of the heavens and the earth; but they only denied, and We punished them for their deeds."
ENAA1051,QA1051,ENAA,1051,Are the people of the region so secure that they lie asleep unaware as Our punishment overtakes them?
ENAA1052,QA1052,ENAA,1052,"Or, are the people of the towns so unafraid that (even when) Our retribution comes upon them in the hours of the morning they remain engrossed in sport and play?"
ENAA1053,QA1053,ENAA,1053,Can they remain secure against the plan of God? Only they feel secure against the plan of God who are certain of being ruined.
ENAA1054,QA1054,ENAA,1054,"Do not the people who inherited the earth from the (earlier) inhabitants perceive that We could afflict them too for their sins if We pleased, and put seals on their hearts that they may not hear (the voice of truth)?"
ENAA1055,QA1055,ENAA,1055,"These were the (earlier) habitations whose accounts We have given to you. Their apostles came with clear proofs, but they did not believe what they once denied. That is how God seals the hearts of those who do not believe."
ENAA1056,QA1056,ENAA,1056,"We did not find many of them faithful to their promises, and found many of them disobedient."
ENAA1057,QA1057,ENAA,1057,"So We sent Moses with miracles after (these apostles) to the Pharaoh and his nobles, but they behaved with them high-handedly. See then the end of the authors of evil."
ENAA1058,QA1058,ENAA,1058,"Moses said: ""O Pharaoh, I have been sent by the Lord of all the worlds;"
ENAA1059,QA1059,ENAA,1059,"""I am duty bound to speak nothing of God but the truth I have brought from your Lord a clear sign; so let the people of Israel depart with me."""
ENAA1060,QA1060,ENAA,1060,"He said: ""If you have brought a sign then display it, if what you say is true."""
ENAA1061,QA1061,ENAA,1061,"At this Moses threw down his staff, and lo, it became a live serpent."
ENAA1062,QA1062,ENAA,1062,"And he drew forth his hand, and behold, it looked white to those who beheld it."
ENAA1063,QA1063,ENAA,1063,"The nobles of Pharaoh said: ""He surely is a clever magician."
ENAA1064,QA1064,ENAA,1064,"""He wishes to drive you away from the land. So what do you advise?"""
ENAA1065,QA1065,ENAA,1065,"They said: ""Put him and his brother off (awhile) and send out heralds to the cities"
ENAA1066,QA1066,ENAA,1066,"""To bring all the wise magicians to you."""
ENAA1067,QA1067,ENAA,1067,"The magicians came to the Pharaoh and said: ""Is there reward for us if we succeed?"""
ENAA1068,QA1068,ENAA,1068,"""Yes,"" said he, ""you will be among the honoured."""
ENAA1069,QA1069,ENAA,1069,"So they said: ""O Moses, you may cast your spell first, or we shall cast ours."""
ENAA1070,QA1070,ENAA,1070,"""You cast it first,"" answered Moses. When they cast their spell, they bewitched the eyes of the people and petrified them by conjuring up a great charm."
ENAA1071,QA1071,ENAA,1071,"We said to Moses: ""Throw down your staff;"" and it swallowed up their conjurations in no time."
ENAA1072,QA1072,ENAA,1072,"Thus the truth was upheld, and the falsehood that they practised was exposed."
ENAA1073,QA1073,ENAA,1073,"Thus there and then they were vanquished and overthrown, humiliated."
ENAA1074,QA1074,ENAA,1074,"The sorcerers fell to the ground in homage,"
ENAA1075,QA1075,ENAA,1075,"And said: ""We have come to believe in the Lord of all the worlds,"
ENAA1076,QA1076,ENAA,1076,"""The Lord of Moses and Aaron."""
ENAA1077,QA1077,ENAA,1077,"But Pharaoh said: ""You have come to accept belief in Him without my permission! This surely is a plot you have hatched to expel the people from the land. You will soon come to know."
ENAA1078,QA1078,ENAA,1078,"""I will have your hands and feet on alternate sides cut off, and have you all crucified."""
ENAA1079,QA1079,ENAA,1079,"They answered: ""We have (in any case) to go back to our Lord."
ENAA1080,QA1080,ENAA,1080,"""The only reason you have to hate us is that we believed in the signs of our Lord as they came to us. O our Lord, give us sufficient endurance that we may die submitting (to You)."""
ENAA1081,QA1081,ENAA,1081,"And the leaders of Pharaoh's people said to him: ""Would you allow Moses and his people to create disorder in the land and discard you and your gods?"" He replied: ""We shall now slay their sons and spare their women, and subdue them."""
ENAA1082,QA1082,ENAA,1082,"Said Moses to his people: ""Invoke the help of God and be firm. The earth belongs to God: He can make whom He wills among His creatures inherit it. The future is theirs who take heed for themselves."""
ENAA1083,QA1083,ENAA,1083,"They said: ""We were oppressed before you came, and have been since you have come to us."" He answered: ""It may well be that soon God may destroy your enemy and make you inherit the land, and then see how you behave."""
ENAA1084,QA1084,ENAA,1084,We afflicted the people of Pharaoh with famine and dearth of everything that they might take heed.
ENAA1085,QA1085,ENAA,1085,"Yet when good came their way they said: ""It is our due;"" but when misfortune befell them they put the omen down to Moses and those who were with him. But surely the omen was with God, yet most of them did not understand."
ENAA1086,QA1086,ENAA,1086,"They said: ""Whatsoever the sign you have brought to deceive us, we shall not believe in you."""
ENAA1087,QA1087,ENAA,1087,"So We let loose on them floods and locusts, and vermin, frogs and blood -- how many different signs. But they still remained arrogant, for they were a people full of sin."
ENAA1088,QA1088,ENAA,1088,"Yet when punishment overtook them, they said: ""O Moses, invoke your Lord for us as you have been enjoined. If the torment is removed, we shall certainly believe in you and let the people of Israel go with you."""
ENAA1089,QA1089,ENAA,1089,But no sooner was the punishment withdrawn for a time to enable them to make good their promise than they broke it.
ENAA1090,QA1090,ENAA,1090,"So We took vengeance on them, and drowned them in the sea for rejecting Our signs and not heeding them."
ENAA1091,QA1091,ENAA,1091,"We then made the people who were weak (and oppressed) successors of the land to the East and the West which We had blessed. Thus the fair promise of your Lord to the children of Israel was fulfilled, for they were patient in adversity; and whatsoever the Pharaoh and his people had fashioned, and the structures they had raised, were destroyed."
ENAA1092,QA1092,ENAA,1092,"When We brought the children of Israel across the sea, and they came to a people who were devoted to their idols, they said: ""O Moses, make us also a god like theirs."" ""You are ignorant,"" he replied."
ENAA1093,QA1093,ENAA,1093,"""These people and their ways will surely be destroyed, for false is what they practise."
ENAA1094,QA1094,ENAA,1094,"""Do you want me to seek for you,"" he said, ""a god other than God, when He has exalted you over all the nations of the world?"
ENAA1095,QA1095,ENAA,1095,"""Remember (the day) when He saved you from the people of Pharaoh who oppressed and afflicted you, and slew your sons and spared your women. In this was a great trial from your Lord."""
ENAA1096,QA1096,ENAA,1096,"We made an appointment of thirty nights with Moses (On Mount Sinai) to which We added ten more; so the term set by the Lord was completed in forty nights. Moses said to Aaron, his brother: ""Deputise for me among my people. Dispose rightly, and do not follow the way of the authors of evil."""
ENAA1097,QA1097,ENAA,1097,"When Moses arrived at the appointed time and his Lord spoke to him, he said: ""O Lord, reveal Yourself to me that I may behold You."" ""You cannot behold Me,"" He said. ""But look at the mountain: If it remains firm in its place you may then behold Me."" But when his Lord appeared on the mountain in His effulgence, it crumbled to a heap of dust, and Moses fell unconscious. When he came to, he said: ""All glory to You. I turn to You in repentance, and I am the first to believe."""
ENAA1098,QA1098,ENAA,1098,"Said (the Lord): ""O Moses, I raised you above all men by sending My messages and speaking to you; so receive what I give you, and be grateful."""
ENAA1099,QA1099,ENAA,1099,"And We wrote down on tablets admonitions and clear explanations of all things for Moses, and ordered him: ""Hold fast to them, and command your people to observe the best in them. I will show you the abode of the wicked."
ENAA1100,QA1100,ENAA,1100,"I will turn those away from My signs who behave unjustly with arrogance in the land so that even though they see all the signs they will not believe in them; and if they see the path of rectitude, will not take it to be a way; and if they see the way of error take it to be the (right) path. This is so for they have called Our messages lies, and have been heedless of them."""
ENAA1101,QA1101,ENAA,1101,Vain are the acts of those who deny Our signs and the meeting in the Hereafter. Can they ever be rewarded for anything but what they did?
ENAA1102,QA1102,ENAA,1102,"In the absence of Moses his people prepared the image of a calf from their ornaments, which gave out the mooing of a cow. Yet they did not see it could neither speak to them nor guide them to the right path. Even then they took it (for a deity) and did wrong."
ENAA1103,QA1103,ENAA,1103,"Then they were filled with remorse and saw that they had erred and said: ""If our Lord does not forgive us we will surely be lost."""
ENAA1104,QA1104,ENAA,1104,"When Moses returned to his people, indignant and grieved, he said: ""How wickedly you behaved in my absence. Why must you hasten the decree of your Lord?"" And he cast aside the tablets, and pulled his brother by the hair. ""O son of my mother,"" said (Aaron), ""these people took advantage of my weakness and almost killed me. Do not let my enemies rejoice at my plight, and do not put me down among transgressors."""
ENAA1105,QA1105,ENAA,1105,"(Moses) said: ""O Lord, forgive me and my brother, and admit us to Your grace, for You are the most compassionate of all."""
ENAA1106,QA1106,ENAA,1106,"Surely those who have taken the calf (as a god) will suffer the anger of their Lord, and disgrace in the world. That is how We requite those who fabricate lies."
ENAA1107,QA1107,ENAA,1107,"Yet those who do wrong, then repent and believe, are forgiven, for your Lord is forgiving and kind."
ENAA1108,QA1108,ENAA,1108,When his anger subsided Moses picked up the tablets. Inscribed on them was guidance and grace for those who fear their Lord.
ENAA1109,QA1109,ENAA,1109,"Moses chose seventy of his people for the appointment (on Mount Sinai). When they arrived they were seized by a tremor. (Moses) said: ""O Lord, if You had so pleased You could have annihilated them and me before this. Will You destroy us for something the foolish among us have done? This is but a trial from You whereby You will lead whom You will astray and guide whom You please. You are our saviour, so forgive us and have mercy on us, for You are the best of forgivers."
ENAA1110,QA1110,ENAA,1110,"Enjoin for us good in the world, and good in the world to come. We turn to You alone."" And the Lord said: ""I punish only those whom I will, but My mercy enfolds everything. I shall enjoin it for those who take heed for themselves, who pay the zakat and believe in My signs,"
ENAA1111,QA1111,ENAA,1111,"Who follow the messenger, the gentile Prophet, described in the Torah and the Gospel, who bids things noble and forbids things vile, makes lawful what is clean, and prohibits what is foul, who relieves them of their burdens, and the yoke that lies upon them. Those who believe and honour and help him, and follow the light sent with him, are those who will attain their goal."""
ENAA1112,QA1112,ENAA,1112,"Say: ""O men, I am verily the apostle of God to you all. His whose kingdom extends over the heavens and the earth. There is no god but He, the giver of life and death. So believe in God and the messenger, the gentile Prophet, sent by Him, who believes in God and His messages. Obey him; you may haply be guided aright."""
ENAA1113,QA1113,ENAA,1113,"Among the people of Moses is a section that shows the way to the truth, and deals justly in accordance with it."
ENAA1114,QA1114,ENAA,1114,"We divided them into twelve (different) tribes. When his people asked for water, We said to Moses: ""Strike the rock with your staff;"" and behold, twelve springs of water gushed forth, so that each of the tribes had a place of its own to drink; and We made the clouds spread shade over them and sent for them manna and quails (and said): ""Eat of the good things We have provided for you."" But (by disobeying) they did not harm Us, they harmed themselves."
ENAA1115,QA1115,ENAA,1115,"And when it was said to them: ""Live in this land and eat of its produce wheresoever you like, and ask for remission of your sins, but pass through the gates with submission (and not pride), We shall forgive your trespasses, and give to those who are righteous abundance,"""
ENAA1116,QA1116,ENAA,1116,The wicked among them changed and perverted the word We had spoken to a word unpronounced; so We sent from heaven retribution on them for all their wickedness.
ENAA1117,QA1117,ENAA,1117,"Enquire of them about the town situated by the sea where, when they did not keep the Sabbath, the fish came up to the surface of the water for them; but on days other than the Sabbath the fish did not come. We tried them in this way, for they were disobedient."
ENAA1118,QA1118,ENAA,1118,"When a Section of them said: ""Why do you admonish a people whom God is about to destroy or to punish severely?"" They replied: ""To clear ourselves of blame before your Lord, and that they may fear God."
ENAA1119,QA1119,ENAA,1119,"But when they forgot to remember the warning, We saved those who prohibited evil, but inflicted on the wicked a dreadful punishment -- requital for their disobedience."
ENAA1120,QA1120,ENAA,1120,"When they persisted in doing what they had been forbidden, We said to them: ""Become (like) apes despised."""
ENAA1121,QA1121,ENAA,1121,"And your Lord declared He would send men against them who would inflict dreadful suffering on them till the Day of Doom, for your Lord is swift in retribution, though He is certainly forgiving and kind."
ENAA1122,QA1122,ENAA,1122,"We dispersed them in groups over the earth, some righteous, some otherwise; and We tried them with good things and bad, that they may haply turn back."
ENAA1123,QA1123,ENAA,1123,"Then after them a new generation inherited the Book. They took to the things of this base world, and said: ""We shall (surely) be forgiven this."" Yet they will accept similar things if they came their way again. Had they not been covenanted in the Book to say nothing in the name of God but the truth? And they have read this in it. The abode of the life to come is better for those who fear God. Can they not comprehend?"
ENAA1124,QA1124,ENAA,1124,"As for those who adhere to the Book and are firm in devotion, We shall certainly not let the wages of those who are upright to go waste."
ENAA1125,QA1125,ENAA,1125,"The day We shook the mountain above them like an awning, and they feared it would fall over them, (We said): ""Hold fast to what We have given you, and bear in mind what is (said) therein so that you may take heed."""
ENAA1126,QA1126,ENAA,1126,"When your Lord brings forth from their loins the offspring of the children of Adam, He makes them witnesses over themselves, (and asks): ""Am I not your Lord?"" 'Indeed,' they reply. 'We bear witness,' -- lest you should say on the Day of Resurrection: ""We were not aware of this;"""
ENAA1127,QA1127,ENAA,1127,"Or, lest they should say: ""It were our fathers who had ascribed compeers to God; we are only their offspring. Will You destroy us for the deeds of those who dealt in vanities?"""
ENAA1128,QA1128,ENAA,1128,That is how We explain Our signs distinctly so that they may come back (to the right path).
ENAA1129,QA1129,ENAA,1129,"Relate to them the plight of the man whom We gave Our signs, but he passed them by, so that Satan came after him, and he went astray."
ENAA1130,QA1130,ENAA,1130,"We wished to exalt him, but he loved baseness and followed his lust. His likeness is that of a dog who hangs out his tongue if you drive him away, and still hangs it out if you leave him alone. Such is the case of the people who deny Our signs. Narrate this history to them; they may haply reflect."
ENAA1131,QA1131,ENAA,1131,Evil is the case of those who deny Our signs and wrong themselves.
ENAA1132,QA1132,ENAA,1132,He alone is guided whom God shows the way; and whom He leads astray is surely lost.
ENAA1133,QA1133,ENAA,1133,"Many of the jinns and human beings have We destined for Hell, who possess hearts but do not feel, have eyes but do not see, have ears but do not hear, like cattle, even worse than them. They are people unconcerned."
ENAA1134,QA1134,ENAA,1134,"All the names of God are beautiful, so call Him by them; and leave those alone who act profanely towards His names: They will be retributed for their deeds."
ENAA1135,QA1135,ENAA,1135,"Yet there are among those We have created people who lead (others) to the truth, and act justly in its light"
ENAA1136,QA1136,ENAA,1136,We shall punish those who deny Our revelations slowly in a way that they will not know.
ENAA1137,QA1137,ENAA,1137,I will just give them respite. My plan is certainly invincible.
ENAA1138,QA1138,ENAA,1138,Have they not bethought themselves their companion is not mad? He is only a plain admonisher.
ENAA1139,QA1139,ENAA,1139,"Have they not contemplated the kingdom of the heavens and the earth and everything created by God, (to educe) that perhaps their own term is drawing to a close? In what lore after this would they then believe?"
ENAA1140,QA1140,ENAA,1140,"Whosoever God allows to go astray has none to show him the way, for He leaves them to wander perplexed in their wickedness."
ENAA1141,QA1141,ENAA,1141,"They ask you about the Hour: ""When is its determined time?"" Say: ""Only my Lord has the knowledge. No one can reveal it except He. Oppressive will it be for the heavens and the earth. When it comes, it will come unawares."" They ask you about it as if you were in the know. You tell them: ""Only God has the knowledge."" But most people do not know."
ENAA1142,QA1142,ENAA,1142,"Tell them: ""I am not master of my own gain or loss but as God may please. If I had the knowledge of the Unknown I would have enjoyed abundance of the good, and no evil would have touched me. I am only a bearer of warnings and bringer of happy news for those who believe."""
ENAA1143,QA1143,ENAA,1143,"It is He who created you from a single cell, and from it created its mate, that you may live as companions. When the man covered the woman she conceived a light burden and carried it about. And when she was heavy (with child) they prayed together to their Lord: ""If You bestow a healthy son on us we shall truly be grateful."""
ENAA1144,QA1144,ENAA,1144,"But when they were given a healthy son, they started ascribing to other powers a share in what God had bestowed on them. But God is above what they ascribe to Him."
ENAA1145,QA1145,ENAA,1145,"Do they associate those with Him who cannot create a thing, and are themselves created,"
ENAA1146,QA1146,ENAA,1146,"Who can neither help them, nor help themselves?"
ENAA1147,QA1147,ENAA,1147,If you call them to guidance they will not follow you. It is all the same if you call them or hold your tongue.
ENAA1148,QA1148,ENAA,1148,"Those whom you invoke besides God are created beings like you. So call on them and let them answer your call, if what you say is true."
ENAA1149,QA1149,ENAA,1149,"Do they have feet to walk on, or hands to hold with, or eyes to see and ears to hear with? Say to them: ""Call your compeers, and work out a plot against me, and do not give me time."
ENAA1150,QA1150,ENAA,1150,My saviour is God who has revealed this Book; and He protects those who are upright;
ENAA1151,QA1151,ENAA,1151,While those you beseech apart from Him cannot help you or even help themselves.
ENAA1152,QA1152,ENAA,1152,"When you call upon them for guidance, they do not hear. When you think they are looking at you, (in fact) they cannot see."""
ENAA1153,QA1153,ENAA,1153,"Cultivate tolerance, enjoin justice, and avoid the fools."
ENAA1154,QA1154,ENAA,1154,"If you are instigated by the Devil to evil seek refuge in God, for God hears all and knows everything."
ENAA1155,QA1155,ENAA,1155,"Verily those who fear God think of Him when assailed by the instigations of Satan, and lo! they begin to understand,"
ENAA1156,QA1156,ENAA,1156,"Even though their (devilish) brothers would like them to continue in error, and would not desist."
ENAA1157,QA1157,ENAA,1157,"And when you do not bring a (Qur'anic) verse to them, they say: ""Why don't you make one up?"" Say: ""I follow only what my Lord reveals to me."" These (revelations) are an evident proof from your Lord, and a guidance and grace for those who believe."
ENAA1158,QA1158,ENAA,1158,When the Qur'an is recited listen to it in silence. You may perhaps be blessed.
ENAA1159,QA1159,ENAA,1159,"Meditate on your Lord inwardly with humility and trepidation, reciting His Book softly, morning and evening, and be not negligent."
ENAA1160,QA1160,ENAA,1160,"Verily those who are in the presence of your Lord are never too proud to worship and celebrate His praises, and bow in homage to Him'."
ENAA1161,QA1161,ENAA,1161,"THEY ASK YOU of (benefits accruing as) spoils of war. Tell them: ""The benefits belong to God and His Messenger."" So fulfil your duty to God and keep peace among yourselves. Obey God and the Prophet, If you really believe."
ENAA1162,QA1162,ENAA,1162,"Only they are true believers whose hearts fill up with awe when the name of God is mentioned; and their faith is further strengthened when His messages are read out to them; and those who place their trust in their Lord,"
ENAA1163,QA1163,ENAA,1163,"Who are firm in devotion, and spend of what We have given them,"
ENAA1164,QA1164,ENAA,1164,"Are true believers. There are for them (high) ranks with their Lord, and pardon and noble provision."
ENAA1165,QA1165,ENAA,1165,"As your Lord sent you from your home (to fight) for the true cause, a section of the faithful were averse,"
ENAA1166,QA1166,ENAA,1166,"Who argued with you about the matter even after it had become quite clear, as if they were being pushed into (the arms of) death as they waited."
