id,quran_ayas_id,quran_ayas_languages_code,number,text
ENAA2310,QA2310,ENAA,2310,Except those who repent and come to believe and do the right. These will enter Paradise and will not be wronged the least
ENAA2311,QA2311,ENAA,2311,In the gardens of Eden promised by Ar-Rahman to His creatures in the unknown (future). Verily His promise will come to pass.
ENAA2312,QA2312,ENAA,2312,"They will hear no vain talk there, but only salutations of peace, and they will have their sustenance morning and evening."""
ENAA2313,QA2313,ENAA,2313,This is the Paradise those of Our creatures will inherit who take heed and fear the displeasure of God.
ENAA2314,QA2314,ENAA,2314,"""We do not come down,"" (will the angels say) ""but only by your Lord's command."" To Him belongs whatever lies before us and behind us, and the space in between. Your Lord does not ever forget:"
ENAA2315,QA2315,ENAA,2315,"Lord of the heavens and the earth and all that lies between them. Therefore worship Him, and be constant in His worship. Do you know any namesake of His?"
ENAA2316,QA2316,ENAA,2316,"Yet man says: ""When I am dead, will I come to life again?"""
ENAA2317,QA2317,ENAA,2317,Does man not remember that before We created him he was nothing?
ENAA2318,QA2318,ENAA,2318,"By your Lord, We shall gather them and the devils together, then bring them crawling on their knees around Hell."
ENAA2319,QA2319,ENAA,2319,We shall pull out of every section those who were most perversely rebellious against Ar-Rahman.
ENAA2320,QA2320,ENAA,2320,We know best who deserve to be burnt in (the Fire).
ENAA2321,QA2321,ENAA,2321,There is not one among you who will not reach it. Your Lord has made this incumbent on Himself.
ENAA2322,QA2322,ENAA,2322,"We shall deliver those who took heed for themselves, and leave the evil-doers kneeling there."
ENAA2323,QA2323,ENAA,2323,"When Our lucid revelations are read out to them, the infidels say to those who believe: ""Which of the two groups is better in standing, and whose company is more excellent?"""
ENAA2324,QA2324,ENAA,2324,How many generations that had far more wealth and ostentation have We laid low before them!
ENAA2325,QA2325,ENAA,2325,"Say: ""Ar-Rahman extends the life of those who are astray until they come to realise what had been promised them was either (physical) affliction or (the terror) of Resurrection. Then will they know who is worse in position, and who is weak in supporters."
ENAA2326,QA2326,ENAA,2326,"God gives greater guidance to those who are guided; and good deeds that endure are better with your Lord for reward, and better for consequence."
ENAA2327,QA2327,ENAA,2327,"Have you seen him who denies Our revelations, and says: ""I will certainly be given wealth and children."""
ENAA2328,QA2328,ENAA,2328,"Has he peeped into the Unknown, or obtained a promise from Ar-Rahman?"
ENAA2329,QA2329,ENAA,2329,"Never so. We shall certainly write down what he says, and prolong the extent of his punishment."
ENAA2330,QA2330,ENAA,2330,"All that he claims will revert to Us, and he will come before Us all alone."
ENAA2331,QA2331,ENAA,2331,They have taken other gods apart from God that they might be a strength to them.
ENAA2332,QA2332,ENAA,2332,Never. They will deny their devotion and become their adversaries.
ENAA2333,QA2333,ENAA,2333,Do you not see that We have set the devils against the infidels to rouse and instigate them?
ENAA2334,QA2334,ENAA,2334,"So, do not be hasty with them. We are counting their number (of days)."
ENAA2335,QA2335,ENAA,2335,"The day We shall usher the righteous before Ar-Rahman like envoys into the presence of a king,"
ENAA2336,QA2336,ENAA,2336,"And drive the wicked into Hell like cattle driven to water,"
ENAA2337,QA2337,ENAA,2337,None will have power to intercede for them except one who obtains a promise from Ar-Rahman.
ENAA2338,QA2338,ENAA,2338,"They say: ""God has begotten a son."""
ENAA2339,QA2339,ENAA,2339,You have uttered a grievous thing
ENAA2340,QA2340,ENAA,2340,"Which would cleave the skies asunder, rend the earth, and split the mountains,"
ENAA2341,QA2341,ENAA,2341,"For they have attributed a son to Ar-Rahman,"
ENAA2342,QA2342,ENAA,2342,When it does not behove the Merciful to have a son.
ENAA2343,QA2343,ENAA,2343,There is no one in the heavens and the earth but comes before Ar-Rahman in all obedience.
ENAA2344,QA2344,ENAA,2344,He has counted them and calculated their number.
ENAA2345,QA2345,ENAA,2345,Every one of them will come before Him all alone on the Day of Resurrection.
ENAA2346,QA2346,ENAA,2346,Surely Ar-Rahman will show love for those who believe and do the right.
ENAA2347,QA2347,ENAA,2347,"So We have made this (Qur'an) easy in your tongue that you may give good news to those who take heed, and warn the people who are contentious."
ENAA2348,QA2348,ENAA,2348,"How many generations have We laid low before them. Do you see any sign of them, or hear the least whisper of them?"
ENAA2349,QA2349,ENAA,2349,TA HA.
ENAA2350,QA2350,ENAA,2350,"We have not sent down the Qur'an to you that you should be burdened,"
ENAA2351,QA2351,ENAA,2351,But as admonition for him who fears --
ENAA2352,QA2352,ENAA,2352,"A revelation from Him who created the earth and the high ascending skies,"
ENAA2353,QA2353,ENAA,2353,"The ever-merciful, established on the throne (of authority)."
ENAA2354,QA2354,ENAA,2354,"Whatever is in the heavens and the earth and in between them, belongs to Him, as whatever lies under the earth."
ENAA2355,QA2355,ENAA,2355,"Whether you say a thing aloud or inaudibly, He has knowledge of the secret and the hidden."
ENAA2356,QA2356,ENAA,2356,God: There is no god but He. To Him belong the attributes most beautiful.
ENAA2357,QA2357,ENAA,2357,Has the story of Moses come to you?
ENAA2358,QA2358,ENAA,2358,"When he saw a fire he said to his family: ""You wait here. I have seen a fire. I may haply be able to bring an ember from it, or find direction by the fire."""
ENAA2359,QA2359,ENAA,2359,"When he approached it, a voice called out:"
ENAA2360,QA2360,ENAA,2360,"""O Moses, I am verily your Lord, so take off your shoes, for you are in the holy plain of Towa."
ENAA2361,QA2361,ENAA,2361,"I have chosen you, so listen to what is revealed to you."
ENAA2362,QA2362,ENAA,2362,"I am God, and there is no god but I, so serve Me, and observe acts of prayer to remember Me."
ENAA2363,QA2363,ENAA,2363,Verily the Hour (of the great change) is about to come. I keep it secret that every soul may be rewarded for its endeavour.
ENAA2364,QA2364,ENAA,2364,"So do not let those who do not believe in it and follow their vain desires, turn you away from it."
ENAA2365,QA2365,ENAA,2365,"What is that in your right band, O Moses?"""
ENAA2366,QA2366,ENAA,2366,"""It's my staff,"" he answered; ""I lean on it, and fell leaves for my goats with it, and I have other uses for it."""
ENAA2367,QA2367,ENAA,2367,"""Throw it down, O Moses,"" said (the Voice)."
ENAA2368,QA2368,ENAA,2368,"So he threw it down, and lo, it became a running serpent."
ENAA2369,QA2369,ENAA,2369,"""Catch it,"" said He, ""and have no fear; We shall revert it to its former state."
ENAA2370,QA2370,ENAA,2370,"And face what is to come with patience, your hand will not be tarnished with blame: Another sign"
ENAA2371,QA2371,ENAA,2371,That We may go on showing you Our greater signs.
ENAA2372,QA2372,ENAA,2372,"Go to the Pharaoh as he has become exceedingly rebellious."""
ENAA2373,QA2373,ENAA,2373,"Moses said: ""O my Lord, enlarge my breast,"
ENAA2374,QA2374,ENAA,2374,And make my mission easy.
ENAA2375,QA2375,ENAA,2375,Remove the defect of my tongue
ENAA2376,QA2376,ENAA,2376,"That they may understand my speech,"
ENAA2377,QA2377,ENAA,2377,And give me as assistant from my family
ENAA2378,QA2378,ENAA,2378,Aaron my brother
ENAA2379,QA2379,ENAA,2379,To strengthen me
ENAA2380,QA2380,ENAA,2380,"And share my task,"
ENAA2381,QA2381,ENAA,2381,"That we may sing Your praises much,"
ENAA2382,QA2382,ENAA,2382,And remember you a great deal.
ENAA2383,QA2383,ENAA,2383,"Surely You know us well."""
ENAA2384,QA2384,ENAA,2384,"He answered: ""Granted is your prayer, O Moses."
ENAA2385,QA2385,ENAA,2385,We have bestowed Our favour on you before this
ENAA2386,QA2386,ENAA,2386,When We told your mother what We relate:
ENAA2387,QA2387,ENAA,2387,"'Put him in a wooden box and cast it in the river. The river will cast it on the bank. An enemy of Ours, and his, will retrieve it.' We bestowed Our love on you that you may be reared under Our eyes."
ENAA2388,QA2388,ENAA,2388,"Then your sister followed you, and said (to the people who had retrieved the child): 'Should I guide you to a person who can nurse him?' We thus brought you back to your mother that her heart may be cheered, and she may not grieve. (Remember) when you killed a man We saved you from anguish; and tested and steeled you (in other ways). Afterwards you sojourned for several years with the people of Midian; then you came up to the measure,"
ENAA2389,QA2389,ENAA,2389,And I chose you for Myself.
ENAA2390,QA2390,ENAA,2390,"Go with My signs, you and your brother, and do not be lax in remembering Me."
ENAA2391,QA2391,ENAA,2391,Then go to the Pharaoh as he has become exceedingly rebellious.
ENAA2392,QA2392,ENAA,2392,"Speak to him gently. He may possibly take heed or may come to have fear."""
ENAA2393,QA2393,ENAA,2393,"They said: ""O our Lord, we are really frightened lest he behave insolently with us or become violent."""
ENAA2394,QA2394,ENAA,2394,"(The Lord) said: ""Be not afraid. I am verily with you, and I hear and see."
ENAA2395,QA2395,ENAA,2395,"So go to him and say: 'The two of us have indeed been sent by your Lord. So let the children of Israel come with us, and do not oppress them. We have come to you with a token from your Lord. Peace on him who follows the way of guidance."
ENAA2396,QA2396,ENAA,2396,It has been revealed to us that punishment will befall him who denies and turns away.
ENAA2397,QA2397,ENAA,2397,"He asked: ""Who then is that Lord of yours, O Moses?"""
ENAA2398,QA2398,ENAA,2398,"(Moses) said: ""Our Lord is He who gave everything its natural form and directed it."""
ENAA2399,QA2399,ENAA,2399,"(The Pharaoh) said: ""And what about the former generations?"""
ENAA2400,QA2400,ENAA,2400,"(Moses) replied: ""Knowledge of that is with my Lord (recorded) in the Book. My Lord neither errs nor forgets."""
ENAA2401,QA2401,ENAA,2401,"It is He who made the earth a bed for you, and traced for you paths upon it, and sends down water from the sky, and brings out through it every kind of vegetation"
ENAA2402,QA2402,ENAA,2402,To eat and feed your cattle. Surely there are signs in these for those who are wise.
ENAA2403,QA2403,ENAA,2403,We created you from the earth and will revert you back to it; and raise you up from it a second time.
ENAA2404,QA2404,ENAA,2404,"So We showed him all Our signs, but he denied them and refused,"
ENAA2405,QA2405,ENAA,2405,"And said: ""Have you come to us, O Moses, to drive us out of our land with your witchery?"
ENAA2406,QA2406,ENAA,2406,"We shall certainly meet you with like magic. So make an appointment when we and you could meet on common ground, which neither we nor you should fail to keep."""
ENAA2407,QA2407,ENAA,2407,"Said (Moses): ""Let your meeting be on the day of the Feast, and let people assemble in broad daylight."""
ENAA2408,QA2408,ENAA,2408,"After this the Pharaoh withdrew and settled his stratagem, then came back."
ENAA2409,QA2409,ENAA,2409,"Moses said to them: ""Woe betide you. Do not fabricate a lie against God, or He will destroy you with some affliction. For he who fabricates lies is doomed to failure."""
ENAA2410,QA2410,ENAA,2410,"So they discussed their strategy among themselves and conferred privately,"
ENAA2411,QA2411,ENAA,2411,"(And) said: ""These two are surely magicians. They want to deprive you of your land with their magic, and eradicate your distinct way (of life)."
ENAA2412,QA2412,ENAA,2412,"So prepare your strategy and come forward. He alone shall win today who is superior."""
ENAA2413,QA2413,ENAA,2413,"They said: ""Either you cast (your spell), O Moses, or we shall cast it first."""
ENAA2414,QA2414,ENAA,2414,"Moses said: ""No. You cast it first"" Then it seemed to Moses that by their magic their cords and rods were flying;"
ENAA2415,QA2415,ENAA,2415,And Moses felt afraid within himself.
ENAA2416,QA2416,ENAA,2416,"We said to him: ""Fear not. You will certainly be victorious."
ENAA2417,QA2417,ENAA,2417,"Throw down what is in your right hand: It will swallow up what they have conjured. For what they have fashioned is only a trick of the sorcerer; and a sorcerer does not succeed wherever he may come."""
ENAA2418,QA2418,ENAA,2418,"The magicians, (seeing the miracle), fell down in prostration, saying: ""We believe in the Lord of Moses and Aaron."""
ENAA2419,QA2419,ENAA,2419,"(The Pharaoh) said: ""You have come to believe without my dispensation. Surely he is your chief who taught you magic. I will have your hands and feet cut off on alternate sides and crucify you on the trunks of date-palm trees. You will come to know whose punishment is harder and protracted."""
ENAA2420,QA2420,ENAA,2420,"They replied: ""We cannot choose you in the face of the clear testimony we have received, and over Him who created us. So do what you are determined to do. All that you would do will only be confined to our life on earth."
ENAA2421,QA2421,ENAA,2421,"We have certainly come to believe in our Lord that He may forgive our trespasses and the magic you have forced us to perform, for God is nobler and abiding."""
ENAA2422,QA2422,ENAA,2422,"Surely for him who comes before his Lord a sinner shall be Hell, where he will neither die nor live."
ENAA2423,QA2423,ENAA,2423,"But whoever comes before Him a believer having done good deeds, will be raised to higher stations --"
ENAA2424,QA2424,ENAA,2424,"Gardens of Eden with rippling streams, where he will live for ever. This is the recompense of those who achieve integrity."
ENAA2425,QA2425,ENAA,2425,"We commanded Moses: ""Journey by night with Our creatures, and strike a dry path for them through the sea. Do not fear being overtaken, nor have dread of any thing."""
ENAA2426,QA2426,ENAA,2426,"Then the Pharaoh followed them with his army, but the sea overpowered and engulfed them."
ENAA2427,QA2427,ENAA,2427,"The Pharaoh had led his people astray, and did not rightly guide them."
ENAA2428,QA2428,ENAA,2428,"O children of Israel, We delivered you from your enemy, and made a covenant with you on the right side of the Mount, and sent down for you manna and quails,"
ENAA2429,QA2429,ENAA,2429,"(And said): ""Eat of the good things We have given you for food, and do not exceed the bounds (of law) in this, or My wrath will surely fall upon you; and he who incurs My wrath will fall into the abyss."
ENAA2430,QA2430,ENAA,2430,"Yet I am gracious to him who repents and believes, and does the right, and follows the straight path."
ENAA2431,QA2431,ENAA,2431,"What made you hurry away, O Moses, from your people?"""
ENAA2432,QA2432,ENAA,2432,"He said: ""They are right behind me. I have hastened to You, O Lord, so that You may be pleased."""
ENAA2433,QA2433,ENAA,2433,"He said: ""We have put your people on trial in your absence; and Sameri has led them astray."""
ENAA2434,QA2434,ENAA,2434,"So Moses returned to his people full of anger and regret. ""O my people,"" he said, ""did not your Lord make you a better promise? Did the time of covenant seem too long to you? Or did you wish the wrath of your Lord to fall upon you that you broke the promise you had made to me?"""
ENAA2435,QA2435,ENAA,2435,"They said: ""We did not break our promise to you of our own will, but we were made to carry the loads of ornaments belonging to the people, which we threw (into the fire), and so did Sameri."
ENAA2436,QA2436,ENAA,2436,"Then he produced the image of a calf which mooed like a cow. And they said: 'This is your god and the god of Moses (whom) he has neglected."""
ENAA2437,QA2437,ENAA,2437,"Did they not see that it did not give them any answer, nor had it power to do them harm or bring them gain?"
ENAA2438,QA2438,ENAA,2438,"Aaron had indeed told them earlier: ""O my people, you are being only misled with this. Surely your Lord is Ar-Rahman. So follow me and obey my command."""
ENAA2439,QA2439,ENAA,2439,"They said ""So long as Moses does not come back we are not going to give it up, and we will remain devoted to it."""
ENAA2440,QA2440,ENAA,2440,"But (Moses) said: ""O Aaron, when you saw that they had gone astray, what hindered you"
ENAA2441,QA2441,ENAA,2441,"From coming after me? Did you not disobey my command?"" (And Moses pulled him by the hair)."
ENAA2442,QA2442,ENAA,2442,"""O son of my mother,"" (Aaron cried), do not pull me by my beard or my hair! I was really afraid you may say that I had created a rift among the children of Israel, and did not pay heed to your command."""
ENAA2443,QA2443,ENAA,2443,"Moses asked: ""O Sameri, what was the matter?"""
ENAA2444,QA2444,ENAA,2444,"He said: ""I saw what they did not see. I picked up a handful of dust from the messenger's tracks and threw it in, for the idea seemed attractive to me."""
ENAA2445,QA2445,ENAA,2445,"(Moses) said: ""Go hence! All your life you are (cursed) to say: 'Do not touch me; and a threat hangs over you which you will not be able to escape. Look at your god to whom you are so attached: We shall verily burn it, and disperse its ashes into the sea."
ENAA2446,QA2446,ENAA,2446,"Your god is only God. There is no other god but He. His knowledge extends over everything."""
ENAA2447,QA2447,ENAA,2447,"Thus do We narrate some account to you of what has gone before, and We have truly given you a Reminder of Our own."
ENAA2448,QA2448,ENAA,2448,"Whoever turns away from it will surely carry a burden on the Day of Judgement,"
ENAA2449,QA2449,ENAA,2449,And will live for ever under it. How evil the burden they will carry on the Day of Doom!
ENAA2450,QA2450,ENAA,2450,"The day the trumpet blast is sounded We shall raise the sinners blind,"
ENAA2451,QA2451,ENAA,2451,"Whispering to one another: ""You have tarried but ten days."""
ENAA2452,QA2452,ENAA,2452,"We know well what they will say when the most upright among them will say: ""You did not tarry more than a day."""
ENAA2453,QA2453,ENAA,2453,"They will ask you about the mountains. Tell them: ""My Lord will uproot them from the base,"
ENAA2454,QA2454,ENAA,2454,"And turn them into a level plain,"
ENAA2455,QA2455,ENAA,2455,Over which you will see no curves or elevations.
ENAA2456,QA2456,ENAA,2456,"That day they will follow the summoner from whom there will be no receding; and their voices will be hushed before Ar-Rahman, and you will not hear a sound but faint shuffling."
ENAA2457,QA2457,ENAA,2457,On that day no intercession will matter other than his whom Ar-Rahman grants permission and accepts.
ENAA2458,QA2458,ENAA,2458,"He knows what is before them and hidden from them, but they cannot grasp it with their knowledge."
ENAA2459,QA2459,ENAA,2459,"All heads will be bowed before the Living, the Eternal; and whosoever bears a load of iniquity will be full of despair."
ENAA2460,QA2460,ENAA,2460,"But he who has done good things and believes, will have no fear of either being wronged or deprived."
ENAA2461,QA2461,ENAA,2461,"That is why We have sent it down as an eloquent Qur'an, and explained in different ways the intimidations through it that they may haply take heed, or perhaps it may lead them to contemplate."
ENAA2462,QA2462,ENAA,2462,"Exalted then be God, the real King; and do not try to anticipate the Qur'an before the completion of its revelation, but pray: ""O Lord, give me greater knowledge."""
ENAA2463,QA2463,ENAA,2463,"We had commanded Adam before, but he disregarded it: We found him lacking in resolution."
ENAA2464,QA2464,ENAA,2464,"When We said to the angels: ''Bow before Adam,'' they all bowed but Iblis, who refused."
ENAA2465,QA2465,ENAA,2465,"So We said; ""O Adam, he is truly your enemy and your wife's. Do not let him have you turned out of Paradise and come to grief."
ENAA2466,QA2466,ENAA,2466,"Verily you will have no hunger or nakedness there,"
ENAA2467,QA2467,ENAA,2467,"Nor thirst nor exposure to the sun."""
ENAA2468,QA2468,ENAA,2468,"But then Satan tempted him by saying: ""O Adam, should I show you the tree of immortality, and a kingdom that will never know any wane?"""
ENAA2469,QA2469,ENAA,2469,"And both ate of (its fruit), and their hidden parts were exposed to one another, and they patched the leaves of the garden (to hide them). Adam disobeyed his Lord, and went astray."
ENAA2470,QA2470,ENAA,2470,"Then his Lord chose him and relented towards him, and showed him the way;"
ENAA2471,QA2471,ENAA,2471,"(And) said: ""Go down hence together, one the enemy of the other. Then will guidance come to you from Me; and whoever follows My direction will neither be disgraced nor be miserable."
ENAA2472,QA2472,ENAA,2472,"But he who fails to heed My warning will have his means restricted; and on the Day of Resurrection We shall raise him blind."""
ENAA2473,QA2473,ENAA,2473,"He will ask: ""O Lord, why have you raised me blind when I was able to see?"""
ENAA2474,QA2474,ENAA,2474,"(God) will say: ""Because Our signs came to you, but you disregarded them. So shall We disregard you this day."""
ENAA2475,QA2475,ENAA,2475,And that is how We requite him who is extravagant and does not believe the signs of his Lord; and surely the punishment of the Hereafter is far more severe and persistent.
ENAA2476,QA2476,ENAA,2476,"Did they not learn from the many generations that We destroyed before them, whose habitations they now frequent? Verily there are signs in this for men of understanding."
ENAA2477,QA2477,ENAA,2477,"If the decree (of respite) had not been pronounced by your Lord, (the inevitable judgement would have ensued); but a term is fixed (for everything)."
ENAA2478,QA2478,ENAA,2478,"So you bear with patience what they say, and sing the praises of your Lord before the rising and setting of the sun, and honour Him in the watches of the night, and then at the two ends of day, that you may find acceptance."
ENAA2479,QA2479,ENAA,2479,Do not covet what We have granted myriads of people of the pomp and glitter of this world to tempt them. The means your Lord has given you are better far and more enduring.
ENAA2480,QA2480,ENAA,2480,"Enjoin on your people service to God, and be yourself constant in it. We do not ask you to provide: It is We who provide for you. The reward is for piety and fear of God."
ENAA2481,QA2481,ENAA,2481,"Yet they say: ""Why does he not bring a sign from his Lord?"" Have not clear proofs come to them in what is contained in the earlier Books?"
ENAA2482,QA2482,ENAA,2482,"If We had destroyed them by some calamity sooner than this, they would have surely said: ""O Lord, if You had sent to us a messenger we would have followed Your command before being humbled and disgraced."""
ENAA2483,QA2483,ENAA,2483,"Say: ""Each one awaits the consequence; so you wait. You will come to know soon who are the men of the straight path and who have come to guidance."
ENAA2484,QA2484,ENAA,2484,"NEAR HAS COME the reckoning for men, but they turn away in remissness."
ENAA2485,QA2485,ENAA,2485,Never does a new reminder come to them from their Lord but they listen to it with dalliance.
ENAA2486,QA2486,ENAA,2486,"Their minds are lost in frivolous pastimes; and the evil-doers discuss secretly: ""Is he not but only a man like you? Then why are you taken in by magic seeingly?"""
ENAA2487,QA2487,ENAA,2487,"He said: ""My Lord knows whatever is spoken in the heavens and the earth. He hears all and knows everything."""
ENAA2488,QA2488,ENAA,2488,"Yet they say: ""These are only confused dreams,"" or rather: ""He has invented them;"" or: ""He is only a poet. Let him therefore bring a miracle to us as the earlier (apostles) were sent with."""
ENAA2489,QA2489,ENAA,2489,Not one habitation that We destroyed before them had believed. So how can they believe?
ENAA2490,QA2490,ENAA,2490,"Never did We send a message before you but through a man, whom We inspired. If you do not know, then ask the keepers of the oracles of God."
ENAA2491,QA2491,ENAA,2491,"We did not make their bodies immune to hunger, nor were they immortal."
ENAA2492,QA2492,ENAA,2492,"Then We made Our promise good to them and delivered whomsoever We pleased, and destroyed the transgressors."
ENAA2493,QA2493,ENAA,2493,We have sent down to you a Book which has a reminder for you. Do you not understand?
ENAA2494,QA2494,ENAA,2494,"How many habitations that were sinful have We demolished utterly, and raised other people after them."
ENAA2495,QA2495,ENAA,2495,Whensoever they sensed Our punishment they fled from them.
ENAA2496,QA2496,ENAA,2496,"""Do not flee; go back to your halls of pleasure and your habitations, so that you may be interrogated."""
ENAA2497,QA2497,ENAA,2497,"""Woe, alas,"" they said, ""we were really sinful."""
ENAA2498,QA2498,ENAA,2498,And this remained their lament till We mowed them down and made them extinct.
ENAA2499,QA2499,ENAA,2499,"We have not created the heavens and the earth, and all that lies between them, out of fun."
ENAA2500,QA2500,ENAA,2500,"If We had pleased to make a plaything We could have made it Ourself, if We had cared to do so."
ENAA2501,QA2501,ENAA,2501,"In fact We strike the truth against the false, which shatters it, and it disappears. Woe to you for what you attribute (to Him)!"
ENAA2502,QA2502,ENAA,2502,"Whosoever is in the heavens and the earth belongs to Him; and those who are near Him do not disdain to worship Him or weary (of His service),"
ENAA2503,QA2503,ENAA,2503,Nor cease to endeavour praising Him night and day.
ENAA2504,QA2504,ENAA,2504,Or have they taken gods from the earth who can raise the dead?
