id,quran_ayas_id,quran_ayas_languages_code,number,text
URAA1040,QA1040,URAA,1040,اور سڑکوں پر اس غرض سے مت بیٹھا کرو کہ الله پر ایمان لانے والوں کو دھمکیاں دو اور الله کی راہ سے روکو اوراس میں ٹیڑھا پن تلاش کرو اور اس حلات کو یاد کرو جب کہ تم تھوڑے تھے پھر الله نے تمہیں زیادہ کر دیا اور دیکھو فساد کرنے والوں کا انجام کیا ہوا ہے
URAA1041,QA1041,URAA,1041,اور اگر تم میں سے ایک جماعت اس پر ایمان لے آئی ہے جو میرے ذریعے سے بھیجا گیا ہے اور ایک جماعت ایمان نہیں لائی پس صبر کرو جب تک الله ہمارے درمیان فیصلہ کرے اور وہ سب سے بہتر فیصلہ کرنے والا ہے
URAA1042,QA1042,URAA,1042,اس کی قوم کے متکبر سرداروں نے کہا اے شعیب ہم تجھے اور انہیں جو تجھ پر ایمان لائے ہیں اپنے شہر سے ضرور نکال دیں گے یا یہ کہ تم ہمارے دین میں واپس آ جاؤ فرمایا کیا اگرچہ ہم اس دین کو ناپسند کرنے والے ہوں
URAA1043,QA1043,URAA,1043,ہم تو الله پر بہتان باندھنے والے ہو جائیں اگر تمہارے مذہب میں واپس آئيں بعد اس کے کہ الله نے ہمیں اس سے نجات دی ہے اور ہمیں یہ حق نہیں کہ تمہارے دین میں لوٹ کر آئيں مگر یہ کہ الله چاہے جو ہمارا رب ہے ہمارے رب کا علم ہر چیز پر احاطہ کیے ہوئے ہے ہم الله ہی پر بھروسہ کرتے ہیں اے رب ہمارے اور ہماری قوم کے درمیان حق کے موافق فیصلہ کر دے اور تو بہتر فیصلہ کرنے والا ہے
URAA1044,QA1044,URAA,1044,اس کی قوم میں جو کافر سردار تھے انہوں نے کہا اگر تم شعیب کی تابعداری کرو گے تو بے شک نقصان اٹھاؤ گے
URAA1045,QA1045,URAA,1045,پھر انہیں زلزلہ نے آ پکڑا پھر وہ صبح تک اپنے گھرو ں میں اوندھے پڑے ہوئے رہ گئے
URAA1046,QA1046,URAA,1046,جنہوں نے شعیب کو جھٹلایا گو وہ وہاں کبھی بسے ہی نہیں تھے جنہوں نے شعیب کو جھٹلایا وہی نقصان اٹھانے والے ہوئے
URAA1047,QA1047,URAA,1047,پھر ان سے منہ پھیرا اور کہا اے میری قوم تحقیق میں نے تمہیں اپنے رب کے احکام پہنچا دیے اور میں نے تمہارے لیے خیر خواہی کی پھر کافروں کی قوم پر میں کیوں کر غم کھاؤں
URAA1048,QA1048,URAA,1048,او رہم نے کسی بستی میں کوئی پیغمبرنہیں بھیجا مگر وہاں کے لوگوں کو سختی اور تکلیف میں پکڑا تاکہ وہ عاجزی کریں
URAA1049,QA1049,URAA,1049,پھر ہم نے برائی کی جگہ بھلائی بدل دی یہاں تک کہ وہ زیادہ ہو گئے اور کہنے لگے کہ ہمارے باپ داداؤں کو بھی تکلیف اور خوشی کا وقت آیا تھا پھر ہم نے انہیں اچانک پکڑا اور ان کو خبر نہ ہوئی
URAA1050,QA1050,URAA,1050,اور اگر بستیوں والے ایمان لے آتے اور ڈرتے تو ہم ان پر آسمان اور زمین سے نعمتوں کے دروازے کھول دیتے لیکن انہوں نے جھٹلایا پھر ہم نے ان کے اعمال کے سبب سے گرفت کی
URAA1051,QA1051,URAA,1051,کیا بستی والے نڈر ہو چکے ہیں کہ ہماری طرف سے ان پر رات کو عذاب آئے جب وہ سو رہے ہوں
URAA1052,QA1052,URAA,1052,یا بستیوں والے اس بات سے نڈر ہو چکے ہیں کہ ان پر ہمارا عذاب دن چڑھے آئے جب وہ کھیل رہے ہوں
URAA1053,QA1053,URAA,1053,کیا وہ الله کی اچانک پکڑ سے بے فکر ہوئے ہیں بس الله کی اچانک پکڑ سے بے فکر ہو گئے ہیں پس الله کی اچانک پکڑ سے بے فکر نہیں ہوتے مگر نقصان اٹھانے والے
URAA1054,QA1054,URAA,1054,کیا ان لوگو ں پر جو زمین کے وارث ہوئے ہیں وہاں کے لوگوں کے ہلاک ہونے کے بعد یہ ظاہر نہیں ہوا کہ اگر ہم چاہیں تو انہیں ان کے گناہوں کے سبب سے پکڑ لیں اور ہم نے ان کے دلوں پر مہر لگا دی ہے پس وہ نہیں سنتے
URAA1055,QA1055,URAA,1055,یہ بستیاں ہیں جن کے حالات ہم تمہیں سناتے ہیں بے شک ان کے پاس ان کے رسولروشن نشانیاں لے کر آئے تھے پھر اس بات پر ہرگز ایمان نہ لائے جسے پہلے جھٹلا چلے تھے کافروں کے دلوں پر الله اسی طرح مہر لگا دیتا ہے
URAA1056,QA1056,URAA,1056,اور ہم نے ان کے اکثر لوگو ں میں عہد کا نباہ نہیں پایا اور ان میں سے اکثر نافرمان پایا
URAA1057,QA1057,URAA,1057,اس کے بعد ہم نے موسیٰ کو اپنی نشانیاں دے کر فرعون اور اس کے سرداروں کی طرف بھیجا پھر انہوں نے نشانیوں سے بے انصافی کی پھر دیکھ مفسدوں کا انجام کیا ہوا
URAA1058,QA1058,URAA,1058,اور موسیٰ نے کہا اے فرعون بے شک میں رب العالمین کی طرف سے رسول ہو کر آیا ہوں
URAA1059,QA1059,URAA,1059,میرے لیے یہی مناسب ہے کہ سوائے سچ کے کوئی بات خدا کی طرف منسوب نہ کروں میں تمہارے رب کی طرف سے تمہارے پاس ایک بڑی دلیل لایا ہوں پس بنی اسرائیل کو میرے ساتھ بھیج دے
URAA1060,QA1060,URAA,1060,کہا اگرتو کوئی نشانی لے کر آیا ہے تو وہ لا اگر تو سچا ہے
URAA1061,QA1061,URAA,1061,پھر اس نے اپنا عصا ڈال دیا وہ اس وقت صریح اژدھا ہو گیا
URAA1062,QA1062,URAA,1062,او راپنا ہاتھ نکالا تو اسی وقت دیکھنے والوں کے لیے سفید نظر آنے لگا
URAA1063,QA1063,URAA,1063,فرعون کی قوم کے سرداروں نے کہا بے شک یہ بڑا ماہر جادو گر ہے
URAA1064,QA1064,URAA,1064,تمہیں تمہارے ملک سے نکالنا چاہتا ہے پس تم کیا مشورہ دیتے ہو
URAA1065,QA1065,URAA,1065,انہوں نے کہا کہ اسے اور اس کے بھائی کو مہلت دے اور شہروں میں جمع کرنے والے بھیج دے
URAA1066,QA1066,URAA,1066,تاکہ تیرے پاس ماہر جادوگر کو لے آئيں
URAA1067,QA1067,URAA,1067,اور جادوگر فرعون کے پاس آئے کہا اگر ہم غالب آئے تو ہمیں کچھ صلہ بھی ملے گا
URAA1068,QA1068,URAA,1068,کہا ہاں اور بے شک تم مقرب ہو جاؤ گے
URAA1069,QA1069,URAA,1069,کہا اے موسیٰ یا تو تو ڈال یا ہم ڈالتے ہیں
URAA1070,QA1070,URAA,1070,کہا تم ڈالوپس جب انہوں نے ڈالا تو لوگو ں کی نظر بندی کر دی اور انہیں ڈرایا اور اک طرح کا بڑا جادو دکھایا
URAA1071,QA1071,URAA,1071,اور ہم نے موسیٰ کو وحی کے ذریعے سے حکم دیا اپنا عصا ڈال دے سو وہ اسی وقت نگلنے لگا جو کھیل انہو ں نے بنا رکھا تھا
URAA1072,QA1072,URAA,1072,پھر حق ظاہر ہو گیا اور جو انہوں نے بنایا تھا وہ غلط ہو گیا
URAA1073,QA1073,URAA,1073,پھر اس جگہ ہار گئے اور ذلیل ہو کر لوٹے
URAA1074,QA1074,URAA,1074,اور جادوگر سجدہ میں گر پڑے
URAA1075,QA1075,URAA,1075,کہاہم رب العالمین پر ایمان لائے
URAA1076,QA1076,URAA,1076,جو موسیٰ اور ہارون کا رب ہے
URAA1077,QA1077,URAA,1077,فرعون نے کہا تم اس پر میری اجازت سے پہلے ہی ایمان لے آئے یہ تو مکر ہے جو تم سب نے اس شہر میں بنایا ہے تاکہ اس شہر کے رہنے والوں کو نکال دو سو اب تمہیں معلوم ہو جائے گا
URAA1078,QA1078,URAA,1078,میں ضرور تمہارے ہاتھ اور دوسری طرف سے پاؤں کاٹوں گا پھر تم سب کو سولی چڑھا دوں گا
URAA1079,QA1079,URAA,1079,انہوں نے کہا ہمیں تو اپنے رب کی طرف لوٹ کر جانا ہی ہے
URAA1080,QA1080,URAA,1080,اور تمہیں ہم سے یہی دشمنی ہے کہ ہم نے اپنے رب کی نشانیوں کو مان لیا جب وہ ہمارے پاس آئیں اے ہمارے رب ہمارے اوپر صبر ڈال اورہمیں مسلمان کر کے موت دے
URAA1081,QA1081,URAA,1081,اور فرعون کی قوم کے سرداروں نے کہا کیا تو موسیٰ اور اس کی قوم کو چھوڑتا ہے تاکہ وہ ملک میں فساد کریں اور تجھے اورتیرے معبودوں کو چھوڑ دے کہا ہم ان کے بیٹوں کو قتل کریں گے اور ان کی عورتو ں کو زندہ رکھیں گے اور بے شک ہم ان پر غالب ہیں
URAA1082,QA1082,URAA,1082,موسیٰ نے اپنی قوم سے کہا الله سے مدد مانگو اور صبر کرو بے شک زمین الله کی ہے اپنے بندوں میں سے جسےچاہے اس کا وارث بنا دے اور انجام بخیر پرہیزگاروں کا ہی ہوتا ہے
URAA1083,QA1083,URAA,1083,انہوں نے کہا تیرے آنے سےپہلے بھی ہمیں تکلیفیں دی گئیں اور تیرے آنے کے بعد بھی فرمایا تمہارا رب بہت جلد تمہارے دشمن کو ہلاک کر دے گا اور اس کی بجائے تمہیں اس سرزمین کا مالک بنا دے گا پھر دیکھے گاتم کیا کرتے ہو
URAA1084,QA1084,URAA,1084,اور ہم نے فرعون والوں کو قحطوں میں اور میوں کی کمی میں پکڑ لیا تاکہ وہ نصیحت مانیں
URAA1085,QA1085,URAA,1085,جب ان پر خوشحالی آتی تو کہتے کہ یہ تو ہمارے لیے ہونا ہی چاہیئے اور اگر انہیں کوئی بدحالی پیش آتی تو موسیٰ اور ان کے ساتھیوں کی نحوست بتلاتے یاد رکھو ان کی نحوست الله کے علم میں ہے لیکن اکثر لوگ نہیں جانتے
URAA1086,QA1086,URAA,1086,اور کہا جوکوئی نشانی تو ہمارے پاس لائے گا ہم پر اس کے ذریعہ سے جادو کرے سو ہم تجھ پر ہر گز ایمان نہ لائیں گے
URAA1087,QA1087,URAA,1087,پھر ہم نے ان پر طوفان اور ٹدی اور جوئیں اورمینڈک اور خون یہ سب کھلے کھلےمعجزے بھیجے پھر بھی انہوں نے تکبر ہی کیا اور لوگ گناہگار تھے
URAA1088,QA1088,URAA,1088,اور جب ان پر کوئی عذاب آتا تو کہتے اے موسیٰ ہمارے لیے اپنے رب سے دعا کر جس کا اس نے تجھ سے عہد کر رکھا ہے اگر تو نے ہم سے یہ عذاب دور کر دیا تو بے شک ہم تجھ پر ایمان لے آئيں گے اور بنی اسرائیل کو تیرے ساتھ بھیج دیں گے
URAA1089,QA1089,URAA,1089,پھر جب ہم نےان سے ایک مدت تک عذاب اٹھا لیا کہ انہیں اس مدت تک پہنچنا تھا اس وقت وہ عہد توڑ ڈالتے
URAA1090,QA1090,URAA,1090,پھر ہم نے ان سے بدلہ لیا پھر ہم نے انہیں دریا میں ڈبو دیا اس لیے کہ انہوں نے ہماری آیتوں کو جھٹلایا اور وہ ان سے غافل تھے
URAA1091,QA1091,URAA,1091,اور ہم نے ان لوگوں کو وارث کر دیا جو اس زمین کے مشرق و مغرب میں کمزور سمجھے جاتے تھے کہ جس میں ہم نے برکت رکھی ہے او رتیرے رب کا نیک وعدہ بنی اسرائیلک کے حق میں ان کے صبر کے باعث پورا ہو گیا اور فرعون اور اس کی قوم نے جو کچھ بنایا تھا ہم نے اسے تباہ کر دیا اور جو وہ اونچی عمارتیں بناتے تھے
URAA1092,QA1092,URAA,1092,اور ہم نے بنی اسرائیل کو دریا سے پار اتارا تو ایک ایسی قوم پر پہنچے جو اپنے بتوں کے پوجنے میں لگے ہوئے تھے کہا اے موسیٰ ہمیں بھی ایک ایسا معبود بنا دے جیسے ان کے معبود ہیں فرمایا بے شک تم لوگ جاہل ہو
URAA1093,QA1093,URAA,1093,یہ لوگ جس چیز میں لگے ہوئے ہیں وہ تباہ ہونے والی ہے اور جو وہ کر رہے ہیں وہ غلط ہے
URAA1094,QA1094,URAA,1094,کہا کیا الله کے سوا تمہارے لیے اور معبود بنا دوں حالانکہ اس نے تمہیں سارے جہاں پر فضیلت دی ہے
URAA1095,QA1095,URAA,1095,اور یا د کرو جب ہم نے تمہیں فرعون والوں سے نجات دی جو تمہیں برا عذاب دیتے تھے تمہارے بیٹوں کو مار ڈال دیتے تھے اور تمہاری عورتوں کو زندہ رکھتے تھے اور اس میں تمہارے رب کا بڑا احسان تھا
URAA1096,QA1096,URAA,1096,اور موسیٰ سے ہم نے تیس رات کا وعدہ کیا اور انہیں اور دس سے پورا کیا پھر تیرے رب کی مدت چالیس راتیں پوری ہو گئی اور موسیٰ نے اپنے بھائی ہارون سے کہا کہ میری قوم میں میرا جانشین رہ اور اصلاح کرتے رہو اور مفسدوں کی راہ پر مت چل
URAA1097,QA1097,URAA,1097,اور جب موسیٰ ہمارے مقرر کردہ وقت پر آئے اور ان کے رب نے ان سے باتیں کیں تو عرض کیا کہ اے میرے رب مجھے دکھا کہ میں تجھے دیکھوں فرمایا کہ تو مجھے ہر گز نہیں دیکھ سکتا لیکن تو پہاڑ کی طرف دیکھتا رہ اگر وہ اپنی جگہ پر ٹھہرا رہا تو تو مجھے دیکھ سکے گا پھر جب اس کے رب نے پہاڑ کی طرف تجلی کی تو اس کو ریزہ ریزہ کر دیا اور موسیٰ بے ہوش ہو کر گر پڑے پھر جب ہوش میں آئے تو عرض کی کہ تیری ذات پاک ہے میں تیری جانب میں توبہ کرتا ہوں اور میں سب سے پہلا یقین لانے والا ہوں
URAA1098,QA1098,URAA,1098,فرمایا اے موسیٰ میں نے پیغمبری اور ہم کلامی سے دوسرے لوگوں پر تجھے امتیاز دیا ہے جو کچھ میں نے تجھے عطا کیا ہے اسے لے لو اور شکر کرنے والوں میں سے ہو جاؤ
URAA1099,QA1099,URAA,1099,اور ہم نے اسے تختیوں پر ہر قسم کی نصیحت اور ہر چیز کی تفصیل لکھ دی سو انہیں مضبوطی سے پکڑ لے او راپنی قوم کو حکم کر کہ اس کی بہتر باتوں پر عمل کریں عنقریب میں تمہیں نافرمانوں کا ٹھکانہ دکھاؤں گا
URAA1100,QA1100,URAA,1100,پھر میں اپنی آیتوں سے انہیں پھیر دوں گا جو زمین میں نا حق تکبر کرتے ہیں اور اگر وہ ساری نشانیاں بھی دیکھ لیں تو بھی ایمان نہیں لائیں گے اور اگر ہدایت کا راستہ دیکھیں تو اسے اپنا راہ نہیں بنائیں گے یہ اس لیے ہے کہ انہوں نے ہماری آیتو ں کو جھٹلایا اور ان سے بے خبر رہے
URAA1101,QA1101,URAA,1101,اور جنھوں نے ہماری آیتوں کو اور آخرت کی ملاقات کو جھٹلایا ان کے اعمال ضائع ہو گئے انہیں وہی سزا دی جائے گی جو کچھ وہ کیا کرتے تھے
URAA1102,QA1102,URAA,1102,اور موسیٰ کی قوم نے اس کے بعد اپنے زیوروں سے بچھڑا بنا لیا ایک جسم تھا جس میں گائے کی آواز تھی کیا انہوں نے یہ نہ دیکھا کہ وہ ان سے بات بھی نہیں کرتا اور نہ ہی انہیں راہ بتاتا ہے اسے معبود بنا لیا اور وہ ظالم تھے
URAA1103,QA1103,URAA,1103,اور جب نادم ہوئے اور معلوم کیا کہ بیشک وہ گمراہ ہوگئے تھےتو کہنے لگے اگر ہمارے رب نے ہم پر رحم نہ کیا اور ہمیں نہ بخشا تو بے شک ہم نقصان پانے والوں میں سے ہوں گے
URAA1104,QA1104,URAA,1104,اور جب موسیٰ اپنی قو م کےی طرف غصہ اور رنج میں بھرے ہوئے واپس آئے تو فرمایا تم نے میرے بعد یہ بڑی نامعقول حرکت کی کیا تم نے اپنے رب کے حکم سے پہلے ہی جلد بازی کر لی اور تختیاں پھینک دیں اور اپنے بھائی کا سر پکڑ ا اسے پنی طرف کھینچنے لگا اس نے کہا کہ اے میری ماں کے بیٹے لوگوں نے مجھے کمزور سمجھا اور قریب تھے کہ مجھے مار ڈالیں سو مجھ پر دشمنوں کو نہ ہنسا اور مجھے گناہگار لوگو ں میں نہ ملا
URAA1105,QA1105,URAA,1105,کہا اے میرے رب مجھے اور میرے بھائی کو معاف فرما اور ہمیں اپنی رحمت میں داخل کر اور تو سب سے زيادہ رحم کرنے والا ہے
URAA1106,QA1106,URAA,1106,بے شک جنہوں نے بچھڑے کو معبود بنایا انہیں ان کے رب کی طرف سے غضب اور دنیا کی زندگی میں ذلت پہنچے گی او رہم بہتان باندھنے والوں کو یہی سزا دیتے ہیں
URAA1107,QA1107,URAA,1107,اور جنہوں نے برے کام کیے پھراس کے بعد توبہ کی اور ایمان لے آئے تو بے شک تیرا رب توبہ کے بعد البتہ بخشنے والا مہربان ہے
URAA1108,QA1108,URAA,1108,اور جب موسیٰ کا غصہ ٹھنڈا ہوا تو اس نے تختیوں کو اٹھایا اور جو ان میں لکھا ہو ا تھا اس میں ان کے واسطے ہدایت اور رحمت تھی جو اپنے رب سے ڈرتے ہیں
URAA1109,QA1109,URAA,1109,اور موسیٰ نے اپنی قوم میں سے ستر مرد ہمارے وعدہ گا ہ پر لانے کے لیے چن لیے پھر جب انہیں زلزلہ نے پکڑ ا تو کہا اے میرے رب اگر تو چاہتا تو پہلے ہی انہیں ہلاک کر دیتا کیا تو ہمیں اس کام پر ہلاک کرتا ہے جو ہماری قوموں کے بیوقوفوں نے کیا یہ سب تیری آزمائش ہے جسے تو چاہے اس سے گمراہ کر دے اور جسے چاہے سیدھا رکھے تو ہی ہمارا کارساز ہے سو ہمیں بخش دے اور ہم پر رحم کر اور تو سب سے بہتر بخشنے والا ہے
URAA1110,QA1110,URAA,1110,او رہمارے لیے اس دنیا میں اور آخرت میں بھلائی لکھ ہم نے تیری طرف رجوع کیا فرمایا میں اپنا عذاب جسے چاہتا ہوں کرتا ہوں اور میری رحمت سب چیزوں سے وسیع ہے پس وہ رحمت ان کے لیے لکھوں گا جو ڈرتے ہیں اجور جو زکواة دیتے ہیں اور جو ہماری آیتوں پر ایمان لاتے ہیں
URAA1111,QA1111,URAA,1111,وہ لوگ جو اس رسول کی پیروی کرتے ہیں اور جو نبی امی ہے جسے اپنے ہاں تورات اور انجیل میں لکھا ہوا پاتے ہیں وہ ان کو نیکی کا حکم کرتا ہے اور برے کام سے روکتا ہے اوران کے لیے سب پاک چیزیں حلا ل کرتا ہے اور ان پر ناپاک چیزیں حرام کرتا ہے اور ان پر سے ان کے بوجھ اور وہ قیدیں اتارتا ہے جو ان پر تھیں سو جو لوگ اس پر ایمان لائے اور اس کی حمایت کی اور اسے مدد دی اور اس کے نور کے تابع ہو ئے جو اس کے ساتھ بھیجا گیا ہے یہی لوگ نجات پانے والے ہیں
URAA1112,QA1112,URAA,1112,کہہ دو اے لوگو تم سب کی طرف الله کا رسول ہوں جس کی حکومت آسمانوں اور زمین میں ہے اس کے سوا اور کوئی معبود نہیں وہی زندہ کرتا اور مارتا ہے پس الله پر ایمان لاؤ اوراس کے رسول نبی امی پر جو کہ الله پر اور اس کے سب کلاموں پر یقین رکھتا ہے اور اس کی پیروی کرو تاکہ تم راہ پاؤ
URAA1113,QA1113,URAA,1113,اور موسیٰ کی قوم میں سے ایک جماعت ہے جو حق کی راہ بتاتے ہیں اور اسی کے موافق انصاف کرتے ہیں
URAA1114,QA1114,URAA,1114,اور ہم نے انہیں جدا جدا کر دیا بارہ دادوں کی اولاد جو بڑی بڑی جماعتیں تھیں اور موسیٰ کو ہم نے حکم بھیجا جب اس کی قوم نے اس سے پانی مانگا کہ اپنی لاٹھی اس پتھر پر مار تو اس سے بارہ چشمے پھوٹ نکلے ہر قبیلہ نے اپنے گھاٹ پہچان لیا اور ہم نے ان پر ابر کا سایہ کیا اور ہم نے من و سلویٰ اتارا ہم نے جو ستھری چیزیں تمہیں دی ہیں وہ کھاؤ اور انہوں نے ہمارا کوئی نقصان نہیں کیا لیکن اپنا ہی نقصان کرتے تھے
URAA1115,QA1115,URAA,1115,اور جب انہیں حکم دیا گیا کہ تم اس بستی میں جا کر رہو اور وہاں جہاں سے تم چاہو کھاؤ اور زباں سے یہ کہتے جاؤ توبہ ہے اور دروازہ میں جھک کر داخل ہو ہم تمہاری غلطیاں معاف کر دیں گے اور نیکو کاروں کو اور زیادہ اجر دیں گے
URAA1116,QA1116,URAA,1116,سو ان میں سے ظالموں نے دوسرا لفظ اس کے سوا بدل دیا جو ان سے کہا گیا تھا پھر ہم نے ان پر آسمان سے عذاب بھیجا اس لیے کہ وہ ظلم کرتے تھے
URAA1117,QA1117,URAA,1117,اور ان سے اس بستی کا حال پوچھ جو دریا کے کنارے پر تھی جب ہفتہ کے معاملہ میں حد سے بڑھنے لگے جب ان کے پاس مچھلیاں ہفتہ کے دن پانی کے اوپر آنے لگیں اور جس دن ہفتہ نہ ہو تو نہ آتی تھیں ہم نے انہیں اس طرح آزمایا اس لیے کہ وہ نافرمان تھے
URAA1118,QA1118,URAA,1118,اور جب ان میں سے ایک جماعت نے کہا ان لوگوں کو کیوں نصیحت کرتے ہو جنہیں الله ہلاک کرنے والا ہے انہیں سخت عذاب دینے والا ہے انہوں نے کہا تمہارے رب کے روبر عذر کرنے کے لیے اور شاید کہ یہ ڈر جائیں
URAA1119,QA1119,URAA,1119,پھر جب وہ بھول گئے اس چیز کو جو انہیں سمجھائی گئی تھی توہم نے انہیں نجات دی جو برے کام سے منع کرتے تھے اور ظالموں کو ان کی نافرمانی کے باعث برے عذاب میں پکڑا
URAA1120,QA1120,URAA,1120,پھر جب وہ اس کام میں حد سے آگے بڑھ گئے جس سے روکے گئے تھے تو ہم نے حکم دیا کہ ذلیل ہونے والے بندر ہو جاؤ
URAA1121,QA1121,URAA,1121,اور یاد کر جب تیرے رب نے خبر دی تھی کہ یہودپر قیامت کے دن تک ایسے شخص کو ضرور بھیجتا رہے گا جو انہیں براعذاب دیتا رہے بے شک تیرا رب جلدی عذاب دینے والا ہے اور تحقیق وہ بحشنے والا مہربان ہے
URAA1122,QA1122,URAA,1122,اورہم نے انہیں ملک میں مختلف جماعتوں میں متفرق کر دیا بعضے ان میں سے نیک ہیں اور بعضے اور طرح کے اور ہم نے انہیں بھلائیوں اور برائیوں سے آزمایاتاکہ وہ لوٹ آئيں
URAA1123,QA1123,URAA,1123,پھر ان کے بعد ان کے ایسے جانشین ہوئے جو کتاب کے وارث بنے اس ادنیٰ زندگی کا مال و متاع لےلیتے ہیں اور کہتے ہیں کہ ہمیں معاف کر دیا جائے گا اور اگر ایسا ہی مال ان کے سامنے پھر آئے تو اسے لے لیتے ہیں کیا ان سے کتاب میں عہد نہیں لے لیا گیا تھا کہ الله کے سوا سچ کے اور کچھ نہ کہیں اور انہوں نے جو کچھ اس میں لکھا ہے پڑھا ہے اور آخرت کا گھر ڈرنے والوں کے لیے بہتر ہے کیا تم سمجھتے نہیں
URAA1124,QA1124,URAA,1124,اور جو لوگ کتاب کے پابند ہیں اور نماز کی پابندی کرتے ہیں بے شک ہم نیکی کرنے والوں کا ثواب ضائع نہیں کریں گے
