id,quran_ayas_id,quran_ayas_languages_code,number,text
URAA4045,QA4045,URAA,4045,فرمایا اے ابلیس! تمہیں اس کےے سجدہ کرنے سے کس نے منع کیا جسے میں نے اپنے ہاتھوں سے بنایا کیا تو نے تکبر کیا یا تو بڑوں میں سے تھا
URAA4046,QA4046,URAA,4046,اس نے عرض کی میں اس سے بہتر ہوں مجھے تو نے آگ سے بنایااور اسے مٹی سے بنایا
URAA4047,QA4047,URAA,4047,فرمایا پھر تو یہاں سے نکل جاکیوں نکہ تو راندہ گیا ہے
URAA4048,QA4048,URAA,4048,اور تجھ پر قیامت تک میری لعنت ہے
URAA4049,QA4049,URAA,4049,عرض کی اے میرے رب! پھر مجھے مردوں کے زندہ ہونے تک مہلت دے
URAA4050,QA4050,URAA,4050,فرمایا پس تمہیں مہلت ہے
URAA4051,QA4051,URAA,4051,وقت معین کے دن تک
URAA4052,QA4052,URAA,4052,عرض کی تیری عز ت کی قسم! میں ان سب کو گمراہ کر دوں گا
URAA4053,QA4053,URAA,4053,مگر ان میں جو تیرے خالص بندے ہوں گے
URAA4054,QA4054,URAA,4054,فرمایا حق بات یہ ہے اور میں حق ہی کہا کرتا ہوں
URAA4055,QA4055,URAA,4055,میں تجھ سے اوران میں سے جو تیرے تابع ہوں گے سب سے جہنم بھر دوں گا
URAA4056,QA4056,URAA,4056,کہہ دو میں اس پر تم سے کوئی مزدوری نہیں مانگتا اور نہ میں تکلف کرنے والوں میں ہوں
URAA4057,QA4057,URAA,4057,یہ قرآن تو تمام جہان کے لیے نصیحت ہے
URAA4058,QA4058,URAA,4058,اور تم کچھ مدت کے بعد اس کا حال ضرور جان لوگے
URAA4059,QA4059,URAA,4059,یہ کتاب الله کی طرف سے نازل کی گئی ہے جو غالب حکمت والا ہے
URAA4060,QA4060,URAA,4060,بے شک ہم نے یہ کتاب ٹھیک طور پر آپ کی طرف نازل کی ہے پس تو خالص الله ہی کی فرمانبرداری مدِ نظر رکھ کر اسی کی عبادت کر
URAA4061,QA4061,URAA,4061,خبردار! خالص فرمانبرداری الله ہی کے لیے ہے جنہوں نے اس کے سوا اور کارساز بنا لیے ہیں ہم ان کی عبادت نہیں کرتے مگر اس لیے کہ وہ ہمیں الله سے قریب کر دیں بے شک الله ان کے درمیان ان باتوں میں فیصلہ کرے گا جن میں وہ اختلاف کرتےتھے بے شک الله اسے ہدایت نہیں کرتا جو جھوٹا ناشکرگزار ہو
URAA4062,QA4062,URAA,4062,اگر الله چاہتا کہ کسی کو فرزند بنائے تواپنی مخلوقات میں سے جسے چاہتا چن لیتا وہ پاک ہے وہ الله ایک بڑا غالب ہے
URAA4063,QA4063,URAA,4063,اس نے آسمانوں اور زمین کو حکمت سے پیدا کیا وہ رات کو دن پر لپیٹ دیتا ہے اور دن کو رات پر لپیٹ دیتا ہے اور اس نے سورج اور چاند کو تابع کر دیا ہے ہر ایک وقت مقرر تک چل رہا ہے خبرادار! وہی غالب بخشنے والا ہے
URAA4064,QA4064,URAA,4064,اس نے تمہیں ایک جان سے پیدا کیا پھر اس نے اس سے اس کی بیوی بنائی اور تمہارے لیے آٹھ نر اور مادہ چارپایوں کے پیدا کیے وہ تمہیں تمہاری ماؤں کے پیٹوں میں ایک کیفیت کے بعد دوسری کیفیت پر تین اندھیروں میں بناتا ہے یہی الله تمہارا رب ہے اسی کی بادشاہی ہے اس کے سوا کوئی معبود نہیں پس تم کہاں پھرے جا رہے ہو
URAA4065,QA4065,URAA,4065,اگر تم انکار کرو تو بے شک الله تم سے بے نیاز ہے اور وہ اپنے بندوں کے لیے کفر کو پسند نہیں کرتا اور اگر تم شکر کرو تو وہ اسے تمہارے لیے پسند کرتا ہے اور کوئی بوجھ اٹھانے والا دوسرے کا بوجھ نہیں اٹھائے گا پھر اپنے رب ہی کی طرف تمہیں لوٹ کر جانا ہے سو وہ تمہیں بتا دے گا جو کچھ تم کرتے رہے ہو بے شک وہ سینوں کے بھید جاننے والا ہے
URAA4066,QA4066,URAA,4066,اور جب انسان کو تکلیف پہنچتی ہے تو اپنے رب کواس کی طرف رجوع کر کے پکارتا ہے پھر جب وہ اسے کوئی نعمت اپنی طرف سے عطا کرتا ہے تو جس کے لیے پہلے پکارتا تھا اسے بھول جاتا ہے اور اس کے لیے شریک بناتا ہے تاکہ اس کی راہ سے گمراہ کرے کہہ دو اپنے کفر میں تھوڑی مدت فائد ہ اٹھا لے بے شک تو دوزخیوں میں سے ہے
URAA4067,QA4067,URAA,4067,(کیا کافر بہتر ہے) یا وہ جو رات کے اوقات میں سجدہ اور قیام کی حالت میں عبادت کر رہا ہو آخرت سے ڈر رہا ہو اور اپنے رب کی رحمت کی امید کر رہا ہو کہہ دو کیا علم والے اور بے علم برابر ہو سکتے ہیں سمجھتے وہی ہیں جو عقل والے ہیں
URAA4068,QA4068,URAA,4068,کہہ دو اے میرے بندو جو ایمان لائےہو اپنے رب سے ڈرو ان کے لیے جنھوں نے اس دنیا میں نیکی کی ہے اچھا بدلہ ہے اور الله کی زمین کشادہ ہے بے شک صبر کرنے والوں کو ان کا اجر بے حساب دیا جائے گا
URAA4069,QA4069,URAA,4069,کہہ دو مجھے حکم ہوا ہے کہ میں الله کی اس طرح عبادت کروں کہ عبادت کو اس کے لیے خاص رکھوں
URAA4070,QA4070,URAA,4070,اور مجھے یہ بھی حکم ہوا ہے کہ میں سب سے پہلا فرمانبردار بنوں
URAA4071,QA4071,URAA,4071,کہہ دو میں بڑے دن کے عذاب سے ڈرتا ہوں اگر اپنے رب کی نافرمانی کروں
URAA4072,QA4072,URAA,4072,کہہ دو میں خالص الله ہی کی اطاعت کرتے ہوئے اس کی عبادت کر تا ہوں
URAA4073,QA4073,URAA,4073,پھر تم اس کے سوا جس کی چاہو عبادت کرو کہہ دو خسارہ اٹھانے والے وہ ہیں جنہوں نے اپنے جان اور اپنے گھر والوں کو قیامت کے روز خسارہ میں ڈال دیا یاد رکھو! یہ صریح خسارہ ہے
URAA4074,QA4074,URAA,4074,ان کے اوپر بھی آگ کے سائبان ہوں گے اور ان کے نیچے بھی سائبان ہوں گے یہی بات ہے جس کا ا لله اپنے بندوں کو خوف دلاتا ہے کہ اے میرے بندو! مجھ سے ڈرتے رہو
URAA4075,QA4075,URAA,4075,اور جو لوگ شیطانوں کو پوجنے سے بچتے رہے اور الله کی طرف رجوع ہوئے ان کے لیے خوشخبری ہے پس میرےبندوں کو خوشخبری دے دو
URAA4076,QA4076,URAA,4076,جو توجہ سے بات کو سنتے ہیں پھر اچھی بات کی پیروی کرتے ہیں یہی ہیں جنہیں الله نے ہدایت کی ہے اور یہی عقل والے ہیں
URAA4077,QA4077,URAA,4077,پس کیا جسے عذاب کا حکم ہو چکا ہے (نجات والے کے برابر ہے) کیا آپ اسے چھوڑ سکتے ہیں جو آگ میں ہے
URAA4078,QA4078,URAA,4078,لیکن جو لوگ اپنےرب سے ڈرتے رہے ان کے لیے بالا خانے ہیں جن کے اوپر اوربالا خانے بنے ہوئے ہیں ان کے نیچے نہریں چلتی ہوں گی یہ الله کا وعدہ ہے اور الله اپنے وعدے کے خلاف نہیں کرتا
URAA4079,QA4079,URAA,4079,کیا آپ نے نہیں دیکھا کہ الله ہی آسمان سے پانی اتارتا ہے پھر اسے چشمے بنا کر زمین میں چلا دیتا ہے پھر اس کے ذریعے سے کھیتی مختلف رنگوں کی اگاتا ہے پھر خوب ابھرتی ہے پھر آپ اسے زردشدہ دیکھتے ہیں پھر اسے ریزہ ریزہ کر دیتا ہے بے شک اس میں عقل مندوں کے لیے عبرت ہے
URAA4080,QA4080,URAA,4080,بھلا جس کا سینہ الله نے دین اسلام کے لئے کھول دیا ہے سو وہ اپنے رب کی طرف سے روشنی میں ہے سوجن لوگوں کے دل الله کے ذکر سے متاثر نہیں ہوتے ان کے لیے بڑی خرابی ہے یہ لوگ کھلی گمراہی میں ہیں
URAA4081,QA4081,URAA,4081,الله ہی نے بہترین کلام نال کیا ہے یعنی کتاب باہم ملتی جلتی ہے (اس کی آیات) دہرائی جاتی ہیں جس سے خدا ترس لوگوں کے رونگٹے کھڑے ہو جاتے ہیں پھر ان کی کھالیں نرم ہوجاتی ہیں اور دل یاد الہیٰ کی طرف راغب ہوتے ہیں یہی الله کی ہدایت ہے اس کے ذریعے سے جسے چاہے راہ پر لے آتا ہے اور جسے الله گمراہ کر دے اسے راہ پر لانے والا کوئی نہیں
URAA4082,QA4082,URAA,4082,بھلا جو شخص اپنے منہ کو قیامت کے دن برے عذاب کی سپر بنائے گا اور ایسے ظالموں کو حکم ہوگا جو کچھ تم کیا کرتے تھے اس کا مزہ چکھو
URAA4083,QA4083,URAA,4083,ان سے پہلے لوگوں نے بھی جھٹلایا تھاپھر ان پر اس طرح عذاب آیا کہ ان کو خبر بھی نہ ہوئی
URAA4084,QA4084,URAA,4084,پھر الله نے ان کو دنیا ہی کی زندگی میں رسوائی کا مزہ چکھایا اور آخرت کا عذاب تو اور بھی زیادہ ہے کاش وہ جانتے
URAA4085,QA4085,URAA,4085,اورہم نے لوگو ں کے لیے اس قرآن میں ہر قسم کی مثال بیان کر دی ہے تاکہ وہ نصیحت پکڑیں
URAA4086,QA4086,URAA,4086,وہ عربی زبان کا بے عیب قرآن ہے تاکہ یہ لوگ ڈریں
URAA4087,QA4087,URAA,4087,الله نے ایک مثال بیان کی ہے ایک غلام ہے جس میں کئی ضدی شریک ہیں اور ایک غلام سالم ایک ہی شخص کا ہے کیا دونوں کی حالت برابر ہے سب تعریف الله ہی کے لیے ہے مگر ان میں سے اکثر نہیں سمجھتے
URAA4088,QA4088,URAA,4088,بے شک آپ کو بھی مرنا ہے اور ان کو بھی مرنا ہے
URAA4089,QA4089,URAA,4089,پھر بے شک تم قیامت کے دن اپنے رب کے ہاں آپس میں جھگڑو گے
URAA4090,QA4090,URAA,4090,پھر اس سے کون زیادہ ظالم ہے جس نے الله پرجھوٹ بولا اور سچی بات کو جھٹلایا جب اس کے پاس آئی کیا دوزخ میں کافروں کا ٹھکانا نہیں ہے
URAA4091,QA4091,URAA,4091,اور جو سچی بات لایا اور جس نے اس کی تصدیق کی وہی پرہیزگار ہیں
URAA4092,QA4092,URAA,4092,ان کے لیے جو کچھ وہ چاہیں گے ان کے رب کے پاس موجود ہوگا نیکو کارو ں کا یہی بدلہ ہے
URAA4093,QA4093,URAA,4093,تاکہ الله ان سے وہ برائیاں دور کر دے جو انہوں نے کی تھیں اور الله ان کو ان کا اجر دے ان نیک کاموں کے بدلہ میں جو وہ کیا کرتے تھے
URAA4094,QA4094,URAA,4094,کیا الله اپنے بندے کو کافی نہیں اور وہ آپ کو ان لوگوں سے ڈراتے ہیں جو اس کے سوا ہیں اور جسے الله گمراہ کر دے تو اسے راہ پر لانے والا کوئی نہیں
URAA4095,QA4095,URAA,4095,اور جسے الله راہ پر لے آئے تو اسے کوئی گمراہ کرنے والا نہیں کیا الله غالب بدلہ لینے والا نہیں ہے
URAA4096,QA4096,URAA,4096,او راگر آپ ان سے پوچھیں آسمانوں اور زمین کو کس نے پیدا کیا ہے تو وہ ضرور کہیں گے الله نے کہہ دو بھلا دیکھو تو سہی جنہیں تم الله کے سوا پکارتے ہو اگر الله مجھے تکلیف دینا چاہے تو کیا وہ اس کی تکلیف کو دور کر سکتے ہیں یا وہ مجھ پر مہربانی کرنا چاہے تو کیا وہ اس مہربانی کو روک سکتے ہیں کہہ دو مجھے الله کافی ہے توکل کرنے والے اسی پر توکل کیا کرتے ہیں
URAA4097,QA4097,URAA,4097,کہہ دو اے میری قوم تم اپنی جگہ پر کام کیے جاؤ میں بھی کر رہا ہوں پھر تمہیں معلوم ہو جائے گا
URAA4098,QA4098,URAA,4098,کہ کس پر عذاب آتا ہےجو اسے رسوا کردے اورکس پردائمی عذاب اترتا ہے
URAA4099,QA4099,URAA,4099,بے شک ہم نے آپ پر یہ کتاب سچی لوگو ں کے لیے اتاری ہے پھر جو راہ پر آیا سو اپنے لیے اور جو گمراہ ہوا سو وہ گمراہ ہوتا ہے اپنے برے کو اور آپ ان کے ذمہ دار نہیں ہیں
URAA4100,QA4100,URAA,4100,اللہ ہی جانوں کو ان کی موت کے وقت قبض کرتا ہے اور ان جانوں کو بھی جن کی موت ان کے سونے کے وقت نہیں آئی پھر ان جانوں کو روک لیتا ہے جن پر موت کا حکم فرما چکا ہے اور باقی جانوں کو ایک میعاد معین تک بھیج دیتا ہے بے شک اس میں ان لوگوں کے لیے نشانیاں ہیں جو غور کرتے ہیں
URAA4101,QA4101,URAA,4101,کیا انہوں نے الله کےسوا اور حمایتی بنا رکھے ہیں کہہ دوکیا اگرچہ وہ کچھ بھی اختیار نہ رکھتے ہوں اور نہ عقل رکھتے ہوں
URAA4102,QA4102,URAA,4102,کہہ دو ہر طرح کی حمایت الله ہی کے اختیار میں ہے آسمانوں اور زمین میں اسی کی حکومت ہے پھر اسی کی طرف تم لوٹائے جاؤ گے
URAA4103,QA4103,URAA,4103,اور جب ایک الله کا ذکر کیا جاتا ہے تو لوگ آخرت پر یقین نہیں رکھتے ان کے دل نفرت کرتے ہیں اور جب اس کے سوا اوروں کا ذکر کیا جاتا ہے تو فوراً خوش ہو جاتے ہیں
URAA4104,QA4104,URAA,4104,کہہ دو اے الله آسمانوں اور زمین کے پیدا کرنے والے ہر چھپی او رکھلی بات کے جاننے والے تو ہی اپنے بندوں میں فیصلہ کرے گا اس بات میں جس میں وہ اختلاف کر رہے ہیں
URAA4105,QA4105,URAA,4105,اور اگر ظالموں کے پاس جو کچھ زمین میں ہے سب ہو اور اسی قدر اس کے ساتھ اور بھی ہو تو قیامت کے بڑے عذاب کے معاوضہ میں دے کر چھوٹنا چاہیں گے اور اللہ کی طرف سے انہیں وہ پیش آئے گا کہ جس کا انہیں گمان بھی نہ تھا
URAA4106,QA4106,URAA,4106,اور برے کاموں کی برائی ان پر ظاہر ہو جائے گی اوران کو وہ عذاب کہ جس پر ہنسی کیا کرتے تھے پکڑ لے گا
URAA4107,QA4107,URAA,4107,پھر جب آدمی پر کوئی مصیبت آتی ہے تو ہمیں پکارتا ہے پھر جب ہم اسے اپنی نعمت عطا کرتے ہیں تو کہتا ہے یہ تومجھے میری عقل سے ملی ہے بلکہ یہ نعمت آزمائش ہے ولیکن ان میں سے اکثر نہیں جانتے
URAA4108,QA4108,URAA,4108,بے شک یہی بات وہ لوگ کہہ چکے ہیں جو ان سے پہلے تھے پس ان کے نہ کام آیا جو کچھ وہ کماتے رہے
URAA4109,QA4109,URAA,4109,پھر ان پر ان کے اعمال کی برائی آ پڑی اور ان میں سے جو لوگ ظلم کر رہے ہیں عنقریب ان کو بھی برے نتائج ان برے عملوں کے پہنچیں گے اور وہ عاجز کرنے والے نہیں ہیں
URAA4110,QA4110,URAA,4110,اور کیا انہیں معلوم نہیں کہ الله ہی روزی کشادہ کر تا ہے جس کی چاہے اور تنگ کرتا ہے بے شک اس میں ان لوگو ں کے لیے نشانیاں ہیں جو ایمان رکھتے ہیں
URAA4111,QA4111,URAA,4111,کہہ دو اے میرے بندو جنہوں نے اپنی جانوں پر ظلم کیا ہے الله کی رحمت سے مایوس نہ ہو بے شک الله سب گناہ بخش دے گا بے شک وہ بخشنے والا رحم والا ہے
URAA4112,QA4112,URAA,4112,اور اپنے رب کی طرف رجوع کرو اور اس کا حکم مانو اس سے پہلے کہ تم پر عذاب آئے پھر تمہیں مدد بھی نہ مل سکے گی
URAA4113,QA4113,URAA,4113,اور ان اچھی باتوں کی پیروی کرو جو تمہارے رب کی طرف سے نازل کی گئی ہیں اس سے پہلے کہ تم پر ناگہاں عذاب آ جائے اور تمہیں خبر بھی نہ ہو
URAA4114,QA4114,URAA,4114,کہیں کوئی نفس کہنے لگے ہائے افسوس اس پر جو میں نے الله کے حق میں کوتاہی کی اور میں تو ہنسی ہی کرتا رہ گیا
URAA4115,QA4115,URAA,4115,یا کہنے لگے اگر الله مجھے ہدایت کرتا تو میں پرہیزگاروں میں ہوتا
URAA4116,QA4116,URAA,4116,یا کہنے لگے جس وقت عذاب کو دیکھے گا کہ کاش مجھے میسر ہو واپس لوٹنا تو میں نیکو کاروں میں سے ہوجاؤں
URAA4117,QA4117,URAA,4117,ہاں تیرے پاس میری آیتیں آ چکی تھیں سو تو نے انہیں جھٹلایا اور تو نے تکبر کیا اور تو منکروں میں سے تھا
URAA4118,QA4118,URAA,4118,اور قیامت کے دن آپ ان لوگوں کو دیکھیں گے جو الله پر جھوٹے الزام لگاتے ہیں کہ ان کے منہ سیاہ ہوں گے کیا دوزخ میں تکبر کرنے والوں کا ٹھکانہ نہیں ہے
URAA4119,QA4119,URAA,4119,اور الله ان لوگوں کو کامیابی کے ساتھ نجات دے گا جو (شرک و کفر سے) بچتےتھے انہیں تکلیف نہیں پہنچے گی اور نہ وہ غمگین ہوں گے
URAA4120,QA4120,URAA,4120,الله ہی ہر چیز کا پیدا کرنے والا ہے اور وہی ہر چیز کا نگہبان ہے
URAA4121,QA4121,URAA,4121,آسمانوں اور زمین کی کنجیاں اسی کے ہاتھ میں ہیں اور جو الله کی آیتوں کے منکر ہوئے وہی نقصان اٹھانے والے ہیں
URAA4122,QA4122,URAA,4122,کہہ دو اے جاہلو کیا مجھے الله کے سوا اور کی عبادت کرنے کا حکم دیتے ہو
URAA4123,QA4123,URAA,4123,اور بے شک آپ کی طرف اور ان کی طرف وحی کیا جا چکا ہے جو آپ سے پہلے ہو گزرے ہیں کہ اگرتم نے شرک کیا تو ضرور تمہارے عمل برباد ہو جائیں گے اور تم نقصان اٹھانے والوں میں سے ہو گے
URAA4124,QA4124,URAA,4124,بلکہ الله ہی کی عبادت کرو اور جس کے شکر گزار رہو
URAA4125,QA4125,URAA,4125,اور انھوں نے الله کی قدر نہیں کی جیسا کہ اس کی قدر کرنے کا حق ہے اور یہ زمین قیامت کے دن سب اسی کی مٹھی میں ہو گی اور آسمان اس کے داہنے ہاتھ میں لپٹے ہوئےہوں گے وہ پاک اور برتر ہے اس سے جو وہ شریک ٹھیراتے ہیں
URAA4126,QA4126,URAA,4126,اور صور پھونکا جائے گا تو بے ہوش ہو جاے گا جو کوئی آسمانوں اورجو کوئی زمین میں ہے مگر جسے الله چاہے پھر وہ دوسری دفعہ صور پھونکا جائے گا تو یکایک وہ کھڑے دیکھ رہے ہوں گے
URAA4127,QA4127,URAA,4127,اور زمین اپنے رب کے نور سے چمک اٹھے گی اور کتاب رکھ دی جاوے گی اور نبی اور گواہ لائے جاویں گے اور ان میں انصاف سے فیصلہ کیا جاوے گا اور ان پر ظلم نہ کیا جائے گا
URAA4128,QA4128,URAA,4128,اورہر شخص کو جو کچھ اس نے کیا تھا پورا پورا بدلہ دیا جائے گا اور وہ خوب جانتا ہے جو کچھ وہ کر رہے ہیں
URAA4129,QA4129,URAA,4129,اور جو کافر ہیں دوزخ کی طرف گروہ گروہ ہانکے جائیں گے یہاں تک کہ جب اسکے پاس آئیں گے تو اس کے دروازے کھول دیے جائیں گے اور ان سے اس کے داروغہ کہیں گے کیا تمہارے پاس تم ہی میں سے رسول نہیں آئےتھے جو تمہیں تمہارے رب کی آیتیں پڑھ کر سناتے تھے اور آج کے دن کےپیش آنے سے تمہیں ڈراتے تھے کہیں گے ہاں لیکن عذاب کا حکم (علم ازلی میں) منکرو ں پر ہو چکا تھا
URAA4130,QA4130,URAA,4130,کہا جائے گا دوزخ کے دروازوں میں داخل ہو جاؤ اس میں سدا رہو گے پس وہ تکبر کرنے والوں کے لیے کیسا برا ٹھکانہ ہے
URAA4131,QA4131,URAA,4131,اور وہ لوگ جو اپنے رب سے ڈرتے رہے جنت کی طرف گرو ہ گروہ لے جانے جائیں گے یہاں تک کہ جب وہ اس کے پا پہنچ جائیں گے اور اس کے دروازے کھلے ہوئے ہوں گے اور ان سے اس کے داروغہ کہیں گے تم پر سلام ہو تم اچھے لوگ ہو اس میں ہمیشہ کے لیے داخل ہو جاؤ
URAA4132,QA4132,URAA,4132,اوروہ کہیں گے الله کا شکر ہے جس نے ہم سے اپنا وعدہ سچا کیا اور ہمیں اس زمین کا وارث کر دیا کہ ہم جنت میں جہاں چاہیں رہیں پھر کیا خوب بدلہ ہے عمل کرنے والوں کا
URAA4133,QA4133,URAA,4133,اور آپ فرشتوں کو حلقہ باندھے ہوئے عرش کے گرد دیکھیں گے اپنے رب کی حمد کے ساتھ تسبیح پڑھ رہے ہیں اور درمیان انصاف سے فیصلہ کیا جائے گا اور سب کہیں گے سب تعریف الله ہی کے لیے ہے جو سارے جہانوں کا رب ہے
URAA4134,QA4134,URAA,4134,حمۤ
URAA4135,QA4135,URAA,4135,یہ کتاب الله کی طرف سے نازل ہوئی ہے جو غالب ہر چیز کا جاننے والا ہے
URAA4136,QA4136,URAA,4136,گناہ بخشنے والا اور توبہ قبول کرنے والا سخت عذاب دینے والا قدرت والا ہے اس کے سوا کوئی معبود نہیں اسی کی طرف لوٹ کر جانا ہے
URAA4137,QA4137,URAA,4137,الله کی آیتوں میں نہیں جھگڑتے مگر وہ لوگ جو کافر ہیں پس ان کا شہرو ں میں چلنا پھرنا آپ کو دھوکا نہ دے
URAA4138,QA4138,URAA,4138,ان سے پہلے قوم نوح اور ان کے بعد اور فرقے بھی جھٹلا چکے ہیں اور ہر ایک امت نے اپنے رسول کو پکڑنے کا ارادہ کیا اور غلط باتوں کے ساتھ بحث کرتے رہے تاکہ اس سے دین حق کو مٹا دیں پھر ہم نے انھیں پکڑ لیا پھر کیسی سزا ہوئی
URAA4139,QA4139,URAA,4139,اور اسی طرح منکروں پر الله کا کلام پورا ہوا کہ وہ دوزخی ہیں
URAA4140,QA4140,URAA,4140,جو (فرشتے) عرش کو اٹھائے ہوئے ہیں اور جو اس کے گرد ہیں وہ اپنے رب کی حمد کے ساتھ تسبیح کرتے رہتے ہیں اور اس پر ایمان لاتے ہیں اور ایمانداروں کے لیے بخشش مانگتے ہیں کہ اے ہمارے رب تیری رحمت اور تیرا علم سب پر حاوی ہے پھر جن لوگو ں نے توبہ کی ہے اور تیرے راستے پر چلتے ہیں انہیں بخش دے اور انہیں دوزخ کے عذاب سے بچا لے
URAA4141,QA4141,URAA,4141,اے ہمارے رب اور انہیں بہشتوں میں داخل کر جو ہمیشہ رہیں گی جن کا تو نے ان سے وعدہ کیا ہے اور ان کو جو ان کے باپ دادوں اوران کی بیویوں اوران کی اولاد میں سے نیک ہیں بے شک تو غالب حکمت والا ہے
URAA4142,QA4142,URAA,4142,اور انہیں برائیوں سے بچا اور جس کو تو اس دن برائیوں سے بچائے گا سو اس پر تو نے رحم کر دیا اور یہ بڑی کامیابی ہے
URAA4143,QA4143,URAA,4143,بے شک جو لوگ کافر ہیں انہیں پکار کر کہا جائے گا جیسی تمہیں (اس وقت) اپنے سے نفرت ہے اس سے بڑھ کر الله کو (تم سے) نفرت تھی جبکہ تم ایمان کی طرف بلائے جاتے تھے پھر نہیں مانا کرتے تھے
URAA4144,QA4144,URAA,4144,وہ کہیں گے اے ہمارے رب تو نے ہمیں دو بار موت دی اورتو نے ہمیں دوبارہ زندہ کیا پس ہم نے اپنے گناہوں کا اقرار کر لیا پس کیا نکلنے کی بھی کوئی راہ ہے
