id,quran_ayas_id,quran_ayas_languages_code,number,text
URAA2424,QA2424,URAA,2424,ہمیشہ رہنے کے باغ جن کے نیچے نہریں بہتی ہوں گی وہ ان میں ہمیشہ رہیں گے اور یہ اس کی جزا ہے جو گناہ سے پاک ہوا
URAA2425,QA2425,URAA,2425,او رہم نے البتہ موسیٰ کو وحی کی کہ میرے بندوں کو راتوں رات لے جا پھر ان کے لیے دریامیں خشک راستہ بنا دے پکڑے جانے سے نہ ڈر اور نہ کسی خطرہ کا خوف کھا
URAA2426,QA2426,URAA,2426,پھر فرعون نے اپنے لشکر کو لے کر ان کا پیچھا کیا پھر انہیں دریا نےڈھانپ لیا جیسا ڈھانپا
URAA2427,QA2427,URAA,2427,اور فرعون نے اپنی قوم کو بہکایا اور راہ پر نہ لایا
URAA2428,QA2428,URAA,2428,اے بنی اسرائیل ہم نے تمہیں تمہارے دشمن سے نجات دی اور تم سے طور کی دائیں طرف کا وعدہ کیا اور تم پر من و سلویٰ اتارا
URAA2429,QA2429,URAA,2429,کھاؤ جو ستھری چیزیں ہم نے تمہیں دی ہیں اور اس میں حد سے نہ گزرو پھر تم پر میرا غضب نازل ہو گا اور جس پرمیرا غضب نازل ہوا سو وہ گڑھے میں جا گرا
URAA2430,QA2430,URAA,2430,اور بے شک میں بڑا بخشنے والا ہوں اس کو جو توبہ کرے اور ایمان لائے اور اچھے کام کرے پھر ہدایت پر قائم رہے
URAA2431,QA2431,URAA,2431,اور اے موسیٰ تجھے اپنی قوم سے پہلے جلدی آنے کا کیا سبب ہوا
URAA2432,QA2432,URAA,2432,کہا وہ بھی میرے پیچھے یہ آ رہے ہیں اور اے میرے رب میں جلدی تیرے طرف آیا تاکہ تو خوش ہو
URAA2433,QA2433,URAA,2433,فرمایا تیری قوم کو تیرے بعد ہم نے آزمائش میں ڈال دیاہےاور انہیں سامری نے گمراہ کر دیا ہے
URAA2434,QA2434,URAA,2434,پھر موسیٰ اپنی قوم کی طرف غصہ میں بھرے ہوئے افسوس کرتے ہوئے لوٹے کہا اے میری قوم کیا تمہارے رب نے تم سے اچھا وعدہ نہیں کیا تھا پھر کیا تم پر بہت زمانہ گزر گیا تھا یا تم نے چاہا کہ تم پر تمہارے رب کا غصہ نازل ہو تب تم نے مجھ سے وعدہ خلافی کی
URAA2435,QA2435,URAA,2435,کہا ہم نےاپنے اختیا ر سے آپ سے وعدہ خلافی نہیں کی لیکن ہم سے اس قوم کے زیور کا بوجھ اٹھوایا گیا تھا سو ہم نے اسے ڈال دیا پھر اسی طرح سامری نے ڈال دیا
URAA2436,QA2436,URAA,2436,پھر ان کے لیے ایک بچھڑا نکال لایا ایک جسم جس میں گائے کی آواز تھی پھر کہا یہ تمہارا اور موسیٰ کا معبود ہے سو وہ بھول گیا ہے
URAA2437,QA2437,URAA,2437,کیا پس وہ نہیں دیکھتے کہ وہ انہیں کس بات کا جواب نہیں دیتا اور ان کے نقصان اور نفع کا بھی اسے اختیار نہیں
URAA2438,QA2438,URAA,2438,اور انہیں ہارون نے اس سے پہلے کہہ دیا تھا اے میری قوم اس سے تمہاری آزمائش کی گئی ہے اور بے شک تمہارا رب رحمان ہے سو میری پیروی کرو اور میرا کہا مانو
URAA2439,QA2439,URAA,2439,کہا ہم برابر اسی پر جمے بیٹھے رہیں گے یہاں تک کہ موسیٰ ہمارے پاس لوٹ کر آئے
URAA2440,QA2440,URAA,2440,کہا اے ہارون تمہیں کس چیز نے روکا جب تم نے دیکھا تھا کہ وہ گمراہ ہو گئے ہیں
URAA2441,QA2441,URAA,2441,تو میرے پیچھے نہ آیا کیا تو نے بھی میری حکم عدولی کی
URAA2442,QA2442,URAA,2442,کہا اے میری ماں کے بیٹے میری داڑھی اور اور سر نہ پکڑ بیشک میں ڈرا اس سے کہ تو کہے گا تو نے بنی اسرائیل میں پھوٹ ڈال دی اور میرے فیصلہ کا انتظار نہ کیا
URAA2443,QA2443,URAA,2443,کہا اے سامری تیرا کیا معاملہ ہے
URAA2444,QA2444,URAA,2444,کہا میں نے وہ چیز دیکھی تھی جو دوسروں نے نہ دیکھی پھر میں نے رسول کے نقشِ قدم کی ایک مٹھی مٹی میں لے کر ڈال دی اور میرے دل نے مجھے ایسی ہی بات سوجھائی
URAA2445,QA2445,URAA,2445,کہا بس چلا جا تیرے لیے زندگی میں یہ سزا ہے کہ توکہے گا ہاتھ نہ لگانا اورتیرے لیے ایک وعدہ ہے جو تجھ سے ٹلنے والا نہیں اور تو اپنے معبود کو دیکھ جس پر تو جما بیٹھا تھا ہم اسے ضرور جلا دیں گے پھر اسے دریا میں بکھیر کر بہا دیں گے
URAA2446,QA2446,URAA,2446,تمہارا معبود ہی الله ہے جس کے سوا کوئی معبود نہیں اس کے علم میں سب چیز سما گئی ہے
URAA2447,QA2447,URAA,2447,ہم اسی طرح سے تجھے گزشتہ لوگوں کی کچھ خبریں سناتے ہیں اور ہم نے تجھے اپنے ہاں سے ایک نصیحت نامہ دیا ہے
URAA2448,QA2448,URAA,2448,جس نے اس سے منہ پھیرا سو وہ قیامت کے دن بوجھ اٹھائے گا
URAA2449,QA2449,URAA,2449,اس میں ہمیشہ رہیں گے اوران کے لیے قیامت کے دن بُرا بوجھ ہوگا
URAA2450,QA2450,URAA,2450,جس دن صور میں پھونکا جائے گا اور ہم اس دن مجرموں کو نیلی آنکھوں والے کر کے جمع کر دیں گے
URAA2451,QA2451,URAA,2451,چپکے چپکے آپس میں باتیں کہتے ہوں گے کہ تم صرف دس دن ٹھیرے ہو
URAA2452,QA2452,URAA,2452,ہم خوب جان لیں گے جو کچھ وہ کہیں گے جب ان میں سے بڑا سمجھدار کہے گا کہ تم صرف ایک ہی دن ٹھہرے ہو
URAA2453,QA2453,URAA,2453,اور تجھ سے پہاڑوں کا حال پوچھتے ہیں سوکہہ دے میرا رب انہیں بالکل اڑا دے گا
URAA2454,QA2454,URAA,2454,پھر زمین کو چٹیل میدان کر کے چھوڑے گا
URAA2455,QA2455,URAA,2455,تو اس میں کجی اور ٹیلا نہیں دیکھے گا
URAA2456,QA2456,URAA,2456,اس دن پکارےنے والے کا اتباع کریں گے اس میں کوئی کجی نہیں ہوگی اور رحمان کے ڈر سے آوازیں دب جائیں گی پھر تو پاؤں کی آہٹ کے سوا کچھ نہیں سنے گا
URAA2457,QA2457,URAA,2457,اس دن سفارش کام نہیں آئے گی مگر جسے رحمان نے اجازت دی اور اس کی بات پسند کی
URAA2458,QA2458,URAA,2458,وہ جانتا ہے جو کچھ ان کے آگے اور پیچھے ہے اور ان کا علم اسے احاطہ نہیں کر سکتا
URAA2459,QA2459,URAA,2459,اور سب منہ حّی و قیوم کے سامنے جھک جائیں گے اور تحقیق نامراد ہوا جس نے ظلم کا بوجھ اٹھایا
URAA2460,QA2460,URAA,2460,اور جو نیک کام کرے گا اور وہ مومن بھی ہو تو اسے ظلم اور حق تلفی کا کوئی خوف نہیں ہو گا
URAA2461,QA2461,URAA,2461,اور اسی طرح ہم نے اسے عربی قرآن نازل کیا ہے اور ہم نے اس میں طرح طرح سے ڈرانے کی باتیں سنائیں تاکہ وہ ڈریں یا ان میں سمجھ پیدا کر دے
URAA2462,QA2462,URAA,2462,سو الله بادشاہ حقیقی بلند مرتبے والا ہے اور تو قرآن کے لینے میں جلدی نہ کر جب تک اس کا اترنا پورا نہ ہوجائےاور کہہ اے میرے رب مجھے اور زیادہ علم دے
URAA2463,QA2463,URAA,2463,اور ہم نے اس سے پہلے آدم سے بھی عہد لیا تھا پھر وہ بھول گیا اور ہم نے اس میں پختگی نہ پائی
URAA2464,QA2464,URAA,2464,اور جب ہم نے فرشتوں سے کہا کہ آدم کو سجدہ کرو تو سوائے ابلیس کے سب نے سجدہ کیا اس نے انکار کیا
URAA2465,QA2465,URAA,2465,پھر ہم نے کہا اے آدم بے شک یہ تیرا اور تیری بیوی کا دشمن ہے سو تمہیں جنت سے نہ نکلوا دے پھر تو تکلیف میں پڑ جائے
URAA2466,QA2466,URAA,2466,بے شک تو اس میں بھوکا اورننگا نہیں ہوگا
URAA2467,QA2467,URAA,2467,اور بے شک تو اس میں نہ پیاسا ہوگا اور نہ تجھے دھوپ لگے گی
URAA2468,QA2468,URAA,2468,پھر شیطان نے اس کے دل میں خیال ڈالا کہا اے آدم کیا میں تجھے ہمیشگی کا درخت بتاؤں اور ایسی بادشاہی جس میں ضعف نہ آئے
URAA2469,QA2469,URAA,2469,پھر دونوں نے اس درخت سے کھایا تب ان پر ان کی برہنگی ظاہر ہوگئی اور اپنے اوپر جنت کے پتے چپکانے لگے اور آدم نے اپنے رب کی نافرمانی کی پھر بھٹک گیا
URAA2470,QA2470,URAA,2470,پھر اس کے رب نے اسے سرفراز کیا پھر اس کی توبہ قبول کی اور راہ دکھائی
URAA2471,QA2471,URAA,2471,فرمایا تم دونوں یہاں سے نکل جاؤ تم میں سے ایک دوسرے کا دشمن ہے پھر اگرتمہیں میری طرف سے ہدایت پہنچے پھر جو میری ہدایت پر چلے گا تو گمراہ نہیں ہو گا اور نہ تکلیف اٹھائے گا
URAA2472,QA2472,URAA,2472,اور جو میرے ذکر سے منہ پھیرے گا تو اس کی زندگی بھی تنگ ہوگی اور اسے قیامت کے دن اندھا کر کے اٹھا ئيں گے
URAA2473,QA2473,URAA,2473,کہے گا اے میرے رب تو نے مجھے اندھا کر کے کیوں اٹھایا حالانکہ میں بینا تھا
URAA2474,QA2474,URAA,2474,فرمائے گا اسی طرح تیرے پاس ہماری آیتیں پہنچی تھیں پھر تو نے انھیں بھلا دیا تھا اور اسی طرح آج تو بھی بھلایا گیا ہے
URAA2475,QA2475,URAA,2475,اور اسی طرح ہم بدلہ دیں گے جو حد سے نکلا اور اپنے رب کی آیتوں پر ایمان نہیں لیا اور البتہ آخرت کا عذاب بڑا سخت اور دیرپا ہے
URAA2476,QA2476,URAA,2476,سو کیا انہیں اس بات سے بھی سمجھ نہیں آئی کہ ہم نے ان سے پہلے کئی جماعتیں ہلاک کر دی ہیں یہ لوگ ان کی جگہوں پر پھرتے ہیں بیشک اس میں عقل والوں کے لیے نشانیاں ہیں
URAA2477,QA2477,URAA,2477,اور اگر تیرے رب کی طرف سے ایک بات پہلے طے شدہ نہ ہوتی اور معیاد معین نہ ہوتی تو عذاب لازمی طور پر ہوتا
URAA2478,QA2478,URAA,2478,پس صبر کر اس پر جو کہتے ہیں اور سورج کے نکلنے اور ڈوبنے سے پہلے اپنے رب کی حمد کے ساتھ تسبیح بیان کر اور رات کی کچھ گھڑیوں میں اور دن کے اول اور آخر میں تسبیح کر تاکہ تجھے خوشی حاصل ہو
URAA2479,QA2479,URAA,2479,اور تو اپنی نظر ان چیزو ں کی طرف نہ دوڑا جو ہم نے مختلف قسم کے لوگوں کو دنیاوی زندگی کی رونق کے سامان دے رکھے ہیں تاکہ ہم انہیں اس میں آزمائیں او رتیرے رب کا رزق بہتر اور دیرپا ہے
URAA2480,QA2480,URAA,2480,اور اپنے گھر والو ں کو نماز کا حکم کر اور خود بھی اس پر قائم رہ ہم تجھ سے روزی نہیں مانگتے ہم تجھے روزی دیتے ہیں اور پرہیزگاری کا انجام اچھا ہے
URAA2481,QA2481,URAA,2481,اور لوگ کہتے ہیں کہ یہ ہمارے پاس اپنے رب سے کوئی نشانی کیوں نہیں لے آتا کیا ان کے پاس پہلی کتابوں کی شہادت نہیں پہنچی
URAA2482,QA2482,URAA,2482,اور اگر ہم انہیں اس سے پہلے کسی عذاب سے ہلاک کر دیتے تو کہتے اے ہمارے رب تو نے ہمارے پاس کوئی رسول کیوں نہ بھیجا تاکہ ہم ذلیل و خوار ہونے سے پہلے تیرے حکموں پر چلتے
URAA2483,QA2483,URAA,2483,کہہ دو ہر ایک انتظار کرنے والا ہے سو تم بھی انتظار کرو آئندہ تمہیں معلوم ہو جائے گا کہ سیدھی راہ پر کون ہے اور ہدایت پانے والا کون ہے
URAA2484,QA2484,URAA,2484,لوگو ں کے حساب کا وقت قریب آ گیا ہے اوروہ غفلت میں پڑ کر منہ پھیرنے والے ہیں
URAA2485,QA2485,URAA,2485,ان کے رب کی طرف سمجھانے کے لیے کوئی ایسی نئی بات ان کے پاس نہیں آتی کہ جسے سن کر ہنسی میں نہ ٹال دیتے ہوں
URAA2486,QA2486,URAA,2486,ان کے دل کھیل میں لگے ہوئے ہیں اور ظالم پوشیدہ سرگوشیاں کرتے ہیں کہ یہ تمہاری طرح ایک انسان ہی تو ہے پھر کیا تم دیدہ دانستہ جادو کی باتیں سنتے جاتے ہو
URAA2487,QA2487,URAA,2487,رسول نے کہا میرا رب آسمان اور زمین کی سب باتیں جانتا ہے اور وہ سننے والا اور جاننے والا ہے
URAA2488,QA2488,URAA,2488,بلکہ کہتے ہیں کہ یہ بیہودہ خواب ہیں بلکہ اس نے جھوٹ بنایا ہے بلکہ وہ شاعر ہے پھر چاہیے کہ ہمارے پاس کوئی نشانی لائے جس طرح پہلے پیغمبر بھیجے گئے تھے
URAA2489,QA2489,URAA,2489,ان سے پہلے کوئی بستی ایمان نہیں لائی تھی جسے ہم نے ہلاک کیا کیا اب یہ ایمان لائیں گے
URAA2490,QA2490,URAA,2490,اور ہم نے تم سے پہلے بھی تو آدمیوں ہی کو رسول بنا کر بھیجا تھا ان کی طرف ہم وحی بھیجا کرتے تھے اگر تم نہیں جانتے تو علم والوں سے پوچھ لو
URAA2491,QA2491,URAA,2491,او رہم نے ان کے ایسے بدن بھی نہیں بنائے تھے کہ وہ کھانانہ کھائیں اور نہ وہ ہمیشہ رہنے والے تھے
URAA2492,QA2492,URAA,2492,پھر ہم نے ان سے وعدہ سچا کر دیا تب انہیں اور جسے ہم نے چاہا نجات دی اور ہم نے حد سے بڑھنے والوں کوہلاک کر دیا
URAA2493,QA2493,URAA,2493,البتہ تحقیق ہم نے تمہارے پاس ایک ایسی کتاب بھیجی ہے جس میں تمہاری نصیحت ہے کیا پس تم نہیں سمجھتے
URAA2494,QA2494,URAA,2494,اور ہم نے بہت سی بستیوں کو جو ظالم تھیں غارت کر دیا ہے اور ان کے بعد ہم نے اور قومیں پیدا کیں
URAA2495,QA2495,URAA,2495,پھر جب انہوں نے ہمارے عذاب کی آہٹ پائی تو وہ فوراً وہاں سے بھاگنے لگے
URAA2496,QA2496,URAA,2496,مت بھاگو اور لوٹ جاؤ جہاں تم نے عیش کیا تھا اور اپنے گھروں میں جاؤ تاکہ تم سے پوچھا جائے
URAA2497,QA2497,URAA,2497,کہنے لگے ہائے ہماری کم بختی بے شک ہم ہی ظالم تھے
URAA2498,QA2498,URAA,2498,سو ان کی یہی پکار رہی یہاں تک کہ ہم نے انہیں ایسا کر دیا جس طرح کھیتی کٹی ہوئی ہو اور وہ بجھ کر رہ گئے
URAA2499,QA2499,URAA,2499,اور ہم نے آسمان اور زمین کو اورجو کچھ ان کے بیچ میں ہے کھیلتے ہوئے نہیں بنایا
URAA2500,QA2500,URAA,2500,اور اگر ہم کھیل ہی بنانا چاہتے تو اپنے پا س کی چیزوں کو بناتے اگر ہمیں یہی کرنا ہوتا
URAA2501,QA2501,URAA,2501,بلکہ ہم حق کو باطل پر پھینک مارتے ہیں پھر وہ باطل کا سر توڑ دیتا ہے پھر وہ مٹنے والا ہوتا ہے او رتم پر افسوس ہے ان باتوں سے جو تم بناتے ہو
URAA2502,QA2502,URAA,2502,اور اسی کا ہے جو کوئي آسمانوں اور زمین میں ہے اور جو اس کے ہاں ہیں اس کی عبادت سے سرکشی نہیں کرتےاور نہ تھکتے ہیں
URAA2503,QA2503,URAA,2503,رات اور دن تسبیح کرتے ہیں سستی نہیں کرتے
URAA2504,QA2504,URAA,2504,کیاانہوں نے زمین کی چیزوں سے ایسے معبود بنا رکھے ہیں جو زندہ کریں گے
URAA2505,QA2505,URAA,2505,اگر ان دونوں میں الله کے سوا اور معبود ہوتے تو دونوں خراب ہو جاتے سو الله عرش کا مالک ان باتوں سے پاک ہے جو یہ بیان کرتے ہیں
URAA2506,QA2506,URAA,2506,جو کچھ وہ کرتاہے اس سے پوچھا نہیں جاتا اور وہ پوچھے جاتے ہیں
URAA2507,QA2507,URAA,2507,کیا انہوں نے اس کے سوا اور بھی معبود بنا رکھے ہیں کہہ دو اپنی دلیل لاؤ یہ میرے ساتھ والو ں کی کتاب اور مجھ سے پہلے لوگوں کی کتابیں موجود ہیں بلکہ اکثران میں سے حق جانتے ہی نہیں اس لیے منہ پھیرے ہوئے ہیں
URAA2508,QA2508,URAA,2508,اور ہم نے تم سے پہلے ایسا کوئی رسول نہیں بھیجا جس کی طرف یہ وحی نہ کی ہو کہ میرے سوا اور کوئی معبود نہیں سومیری ہی عبادت کرو
URAA2509,QA2509,URAA,2509,اور کہتے ہیں کہ الله نے اولاد بنا رکھی ہے وہ پاک ہے لیکن وہ معزز بندے ہیں
URAA2510,QA2510,URAA,2510,بات کرنے میں اس سے پیش قدمی نہیں کرتے اور وہ اسی کے حکم پر کام کرتے ہیں
URAA2511,QA2511,URAA,2511,وہ جانتا ہے جو ان کے آگے اور جو ان کے پیچھے ہے اور وہ شفاعت بھی نہیں کرتے مگر اسی کے لیے جس سے وہ خوش ہو اور وہ اس کی ہیبت سے ڈرتے ہیں
URAA2512,QA2512,URAA,2512,اورجو کوئی ان میں سے یہ کہے کہ بے شک میں اس کے سوا خدا ہوں تو اسی پر ہم اسے جہنم کی سزاد یں گے ہم اسی طرح ظالموں کو سزا دیا کرتے ہیں
URAA2513,QA2513,URAA,2513,کیا منکروں نے نہیں دیکھا کہ آسمان اور زمین جڑے ہوئے تھے پھر ہم نے انھیں جدا جدا کر دیا اورہم نے ہر جاندار چیز کو پانی سے بنایا کیا پھر بھی یقین نہیں کرتے
URAA2514,QA2514,URAA,2514,اورہم نے زمین میں بھاری پہاڑ رکھ دیئے تاکہ انہیں لے کر داھر اُدھر نہ جھکنے پائے اور ہم نے اس میں کشادہ راہیں بنا دی ہیں تاکہ وہ راہ پائیں
URAA2515,QA2515,URAA,2515,اور ہم نے آسمان کو ایک محفوظ چھت بنا دیا اور وہ آسمان کی نشانیوں سے منہ موڑنے واے ہیں
URAA2516,QA2516,URAA,2516,اور وہی ہے جس نے رات اور دن اور سورج اور چاند بنائے سب اپنے اپنے چکر میں پھرتے ہیں
URAA2517,QA2517,URAA,2517,اور ہم نے تجھ سے پہلے کسی آدمی کو ہمیشہ کے لیے زندہ رہنے نہیں دیا پھر کیا اگر تو مر گیا تو وہ رہ جائیں گے
URAA2518,QA2518,URAA,2518,ہر ایک جاندار موت کا مزہ چکھنے والا ہے اور ہم تمہیں برائی اوربھلائی سے آزمانے کے لیے جانچتے ہیں اورہماری طرف لوٹائے جاؤ گے
URAA2519,QA2519,URAA,2519,اور جہاں تمہیں کافر دیکھتے ہیں تو انہیں تجھ سے سوائے ٹھٹھا کرنے کے اور کوئی کام نہیں کیا یہی شخص ہے جو تمہارے معبودوں کا نام لیتا ہے اور وہ رحمان کے نام سے منکر ہیں
URAA2520,QA2520,URAA,2520,آدمی جلد باز بنایا گیا ہے میں تمہیں اپنی نشانیاں ابھی دکھاتا ہوں سو جلدی مت کرو
URAA2521,QA2521,URAA,2521,ور کہتے ہیں یہ وعدہ کب ہوگا اگر تم سچے ہو
URAA2522,QA2522,URAA,2522,کاش یہ منکر اس وقت کو جان لیں کہ اپنے مونہوں اوراپنی پیٹھوں سے آگ کو روک نہیں سکیں گے اور نہ وہ مدد کیے جائیں گے
URAA2523,QA2523,URAA,2523,بلکہ وہ ان پر ناگہان آئے گی پھر وہ ان کے ہوش کھو دے گی پھر نہ اسے ٹال سکیں گے اورنہ انہیں مہلت دی جائے گی
URAA2524,QA2524,URAA,2524,اور تجھ سے پہلے بھی رسولوں کے ساتھ ٹھٹھا کیا گیا ہے پھر جس عذاب کی بابت وہ ہنسی کیا کرتے تھے ان ٹھٹھا کرنے والوں پر وہی آ پڑا
URAA2525,QA2525,URAA,2525,کہہ دو تمہاری رات اور دن میں رحمان سے کون نگہبانی کرتا ہے بلکہ وہ اپنے رب کے ذکر سے منہ موڑنے والے ہیں
URAA2526,QA2526,URAA,2526,کیا ہم سے ان کےمعبود انہیں بچائے رکھتے ہیں وہ تو خود اپنی بھی مدد نہیں کر سکتے اورنہ ہمارے مقابلہ میں ان کا کوئی ساتھ دے گا
URAA2527,QA2527,URAA,2527,بلکہ ہم نے ان کو اور ان کے باپ دادا کو خوب سامان دیا یہاں تک کہ ان پر ایک عرصہ دراز گزر گیا کیا وہ یہ نہیں دیکھتے کہ بے شک ہم زمین کو ہر طرف سے گھٹاتے چلے جاتے ہیں سو کیا یہ لوگ غالب آنے والے ہیں
URAA2528,QA2528,URAA,2528,کہہ دو کہ میں تو صرف وحی کے ذریعہ سے تمہیں ڈراتا ہوں اور یہ بہرے جس وقت ڈرائے جاتے ہیں سنتے ہی نہیں
URAA2529,QA2529,URAA,2529,اور البتہ اگر انہیں تیرے رب کا عذاب کا ایک جھونکا بھی لگ جائے تو ضرور کہیں گے کہ ہائے ہماری کم بختی بے شک ہم ظالم تھے
URAA2530,QA2530,URAA,2530,اور قیامت کے دن ہم انصاف کی ترازو قائم کریں گے پھرکسی پر کچھ ظلم نہ کیا جائے گا اور اگر رائی کے دانہ کے برابر بھی عمل ہو گا تو اسے بھی ہم لے آئیں گے اور ہم ہی حساب لینے کے لیے کافی ہیں
URAA2531,QA2531,URAA,2531,اور البتہ تحقیق ہم نے موسیٰ اور ہارون کو فیصلہ کرنے والی اور روشنی دینے والی اور پرہیز گاروں کو نصیحت کرنے والی کتاب دی تھی
URAA2532,QA2532,URAA,2532,جو اپنے رب سے بن دیکھے ڈرتے ہیں اور قیامت کا بھی خوف رکھنے والے ہیں
URAA2533,QA2533,URAA,2533,اور یہ ایک مبارک نصیحت ہے جسے ہم نازل کیاہے پھر کیا تم اس کے بھی منکر ہو
URAA2534,QA2534,URAA,2534,اور ہم نے پہلے ہی سے ابراھیم کو اس کی صلاحیت عطا کی تھی اور ہم اس سے واقف تھے
URAA2535,QA2535,URAA,2535,جب اس نے اپنے باپ اور اپنی قوم سے کہا کہ یہ کیسی مورتیں ہیں جن پر تم مجاور بنے بیٹھے ہو
URAA2536,QA2536,URAA,2536,انہوں نے کہا ہم نے اپنے باپ دااد کو انہیں کی پوجا کرتے پایا ہے
URAA2537,QA2537,URAA,2537,کہا البتہ تحقیق تم اور تمہارے باپ دادا صریح گمراہی میں رہے ہو
URAA2538,QA2538,URAA,2538,انھوں نے کہا کیا تو ہمارے پاس سچی بات لایا ہے یا تو دل لگی کرتا ہے
URAA2539,QA2539,URAA,2539,کہا بلکہ تمہارا رب تو آسمانوں اور زمین کا رب ہے جس نے انہیں بنایا ہے اور میں اسی بات کا قائل ہوں
URAA2540,QA2540,URAA,2540,اور الله کی قسم میں تمہارے بتوں کا علاج کروں گا جب تم پیٹھ پھیر کر جا چکو گے
URAA2541,QA2541,URAA,2541,پھر ان کے بڑے کے سوا سب کو ٹکڑے ٹکڑے کر دیا تاکہ اس کی طرف رجوع کریں
URAA2542,QA2542,URAA,2542,انہوں نے کہا ہمارے معبودوں کے ساتھ کس نے یہ کیا ہے بے شک وہ ظالموں میں سے ہے
URAA2543,QA2543,URAA,2543,انہو ں نے کہا ہم نے سنا ہے کہ ایک جو ان بتوں کو کچھ کہا کرتا ہے اسے ابراھیم کہتے ہیں
URAA2544,QA2544,URAA,2544,کہنے لگے اسے لوگوں کے سامنے لے آؤ تاکہ وہ دیکھیں
URAA2545,QA2545,URAA,2545,کہنے لگے اے ابراھیم کیا تو نے ہمارے معبودوں کے ساتھ یہ کیا ہے
URAA2546,QA2546,URAA,2546,کہا بلکہ ان کے اس بڑے نے یہ کیا ہے سو ان سے پوچھ لو اگر وہ بولتے ہیں
